RazaoSocial,UF,Total_Despesas,Media_Despesas,Desvio_Padrao
UNIMED SÃO LOURENÇO COOPERATIVA DE TRABALHO MÉDICO,MG,10270170673.63,4364713.418457288,14001460.689234173
UNIMED MEIO OESTE CATARINENSE COOPERATIVA DE TRABALHO MÉDICO,SC,10269889796.75,4159534.142061563,13408447.874983868
UNIMED LITORAL SUL/RS - COOPERATIVA DE ASSISTÊNCIA À SAÚDE LTDA.,RS,10156408983.0,3556165.6102941176,11283588.653752208
UNIMED CONSELHEIRO LAFAIETE COOPERATIVA DE TRABALHO MÉDICO LTDA,MG,9924669401.09,4039344.4855881156,13176194.023511594
SAUDE PAS - MEDICINA E ODONTO,RS,9809120994.23,7505065.795126243,22106292.067038152
CAIXA DE ASSISTÊNCIA OSWALDO CRUZ,RJ,9807124171.23,8241280.816159664,23015859.227365743
CAIXA SEGURADORA ESPECIALIZADA EM SAÚDE S/A,SP,9728317377.44,8343325.366586621,31395758.109532773
UNIMED VALE DO CAÍ/RS - COOPERATIVA DE ASSISTÊNCIA À SAÚDE LTDA.,RS,9714889789.35,4144577.5551834474,12515223.941045305
PLURAL GESTÃO EM PLANOS DE SAÚDE LTDA,RJ,9623865607.710001,7368962.946179174,16382533.322475111
UNIMED ALTO SÃO FRANCISCO COOPERATIVA DE TRABALHO MÉDICO,MG,9566390197.79,4303369.409712101,16036497.640078336
"FEDERAÇÃO DAS SOCIEDADES COOPERATIVAS DE TRABALHO MÉDICO DO ACRE, AMAPÁ, AMAZONAS, PARÁ, RONDONIA E RORAIMA",AM,9506226172.69,14425229.39710167,43738890.556379795
UNIMED MONTES CLAROS COOPERATIVA DE  TRABALHO MÉDICO LTDA.,MG,9478235347.94,4552466.5456003845,13431325.81425967
UNIMED CURVELO COOPERATIVA DE TRABALHO MÉDICO LTDA.,MG,9443431367.65,3848179.041422168,13365661.01673199
UNIHOSP SAÚDE LTDA,SP,9335792571.82,8464000.518422484,22439868.44630936
UNIMED DE BRUSQUE COOPERATIVA DE TRABALHO MÉDICO,SC,9300100958.13,4532212.9425584795,12896417.954193754
UNIMED ERECHIM - COOPERATIVA DE SERVIÇOS DE SAÚDE LTDA.,RS,9298151759.19,3386071.288852877,10034768.710670507
UNIMED ARARUAMA COOPERATIVA DE TRABALHO MÉDICO LTDA,RJ,9253405656.66,3634487.689183032,11766363.802442256
UNIMED DE CAÇAPAVA - COOPERATIVA DE TRABALHO MEDICO,SP,9245460648.87,2935998.9358113687,9503066.174830016
UNIMED PATO BRANCO SOCIEDADE COOPERATIVA DE MÉDICOS,PR,9232191344.18,2855611.3034890196,12452435.243438195
LUMINAR SAÚDE - ASSOCIAÇÃO DE ASSISTÊNCIA À SAÚDE,DF,9224952587.54,5570623.543200484,15921397.628390457
UNIMED RESENDE COOPERATIVA DE TRABALHO MÉDICO,RJ,9181811537.32,4069951.922570922,11772078.632389953
UNIMED GUARAPUAVA COOPERATIVA DE TRABALHO MÉDICO,PR,9079940534.77,3700057.267632437,11396749.475673186
SAMI ASSISTÊNCIA MÉDICA LTDA,SP,8918897331.31,7858059.322740087,29034081.31653369
CABERJ INTEGRAL SAÚDE S.A,RJ,8790493692.15,6971049.716217288,19526235.33297268
UNIMED ENCOSTA DA SERRA/RS SOCIEDADE COOPERATIVA DE SERVIÇOS DE SAÚDE LTDA.,RS,8722167397.35,3264284.2055950603,11990940.39535478
UNIMED PARÁ DE MINAS COOPERATIVA DE TRABALHO MÉDICO LTDA.,MG,8698960647.39,4103283.3242405658,12306774.973018523
UNIMED COSTA DO DESCOBRIMENTO COOPERATIVA DE TRABALHO MÉDICO,BA,8691207998.88,4524314.418990109,14445328.00922154
FUNDAÇAO COMPESA DE PREVIDENCIA E ASSISTENCIA - COMPESAPREV,PE,8622895113.19,7185745.927658333,19786337.82341955
OPERADORA UNIESTE DE PLANOS DE SAÚDE LTDA,RJ,8607642991.09,6161519.678661417,16666031.955313705
ASSOCIAÇÃO DE ASSISTÊNCIA MÉDICO HOSPITALAR DOS MAGISTRADOS DO ESTADO DO PARANÁ,PR,8561148310.53,7589670.48805851,24356634.389186174
FUNDAÇÃO FILANTRÓPICA E BENEFICENTE DE SAÚDE ARNALDO GAVAZZA FILHO,MG,8349036921.43,5115831.446954657,13597766.711861823
DENTAL UNI - COOPERATIVA ODONTOLÓGICA,PR,8328915303.2,5029538.226570048,14650287.00244169
UNIMED DE TATUI - COOPERATIVA DE TRABALHO MÉDICO,SP,8315438026.11,3108574.963031776,9922198.4663211
ASSOCIAÇÃO PADRE ALBINO SAÚDE,SP,8193150863.75,6710197.267608518,18470393.15124698
SANTA CASA DE MISERICÓRDIA E BENEFICÊNCIA PORTUGUESA,SP,8154550808.05,5382541.787491749,12897249.678102428
UNIMED DE OURINHOS - COOPERATIVA DE TRABALHO MÉDICO,SP,8115651305.5,3709164.216407678,13230612.923472615
UNIMED DE JABOTICABAL COOP. DE TRABALHO MÉDICO,SP,8100265694.86,3127515.7123011583,10025277.95720018
CENTRAL REGIONAL DAS COOPERATIVAS MÉDICAS - UNIMED CERRADO,GO,8082762805.58,4799740.383361045,13363351.636001205
ASSOCIAÇÃO DE ASSISTÊNCIA À SAÚDE DOS EMPREGADOS DA COPASA,MG,7996365270.63,5388386.300963612,15212945.366027698
VALEM ADMINISTRADORA DE BENEFÍCIOS LTDA,MG,7962110654.66,6110599.120997697,18008156.842489958
UNIMED BARRA DO GARÇAS - COOPERATIVA DE TRABALHO MÉDICO,MT,7929124409.2,3088868.0986365406,10565969.010114733
UNIMED DE PINDAMONHANGABA - COOPERATIVA TRABALHO MEDICO,SP,7809407245.7300005,2762436.2383197737,8317877.20606843
SIM - CAIXA DE ASSISTÊNCIA À SAÚDE,SC,7763798355.440001,5277905.068280082,16525712.666402051
ASSOCIAÇÃO DOS SERVIDORES FISCAIS DO ESTADO DA BAHIA,BA,7700167698.82,5281322.152825789,14030422.159550337
QUALICORP CLUBE DE SAÚDE ADMINISTRADORA DE BENEFÍCIOS LTDA.,SP,7670535632.58,6941661.205954751,15763674.93152166
UNIMED SÃO JOÃO DEL REI - COOPERATIVA DE TRABALHO MÉDICO,MG,7652269447.62,3164710.2761042183,9564497.010691518
"ASSOCIAÇÃO DOS SERVIDORES MUNICIPAIS, ESTADUAIS E FEDERAIS DO RIO DE JANEIRO",RJ,7564568575.28,6120201.112686084,14548572.660464847
PLANO DE SAÚDE DA SANTA CASA DE BRAGANÇA PAULISTA,SP,7542053617.12,6019196.821324821,17793963.43638994
UNIMED NORTE FLUMINENSE COOPERATIVA DE TRABALHO MEDICO,RJ,7541992519.13,3504643.363907993,10355643.006075352
UNIMED SUDOESTE DE MINAS COOPERATIVA DE TRABALHO MÉDICO,MG,7486990808.96,3602979.2150914343,10497576.071104871
SANTA CASA DE MISERICORDIA DE SAO JOAQUIM DA BARRA,SP,7465486717.47,4383726.786535526,11934674.665765265
CAIXA DE ASSISTÊNCIA SISTEMA SAÚDE INTEGRAL-SSI SAUDE,RS,7461430906.52,5870519.989394179,18702569.006919224
SÃO FRANCISCO ASSISTÊNCIA MÉDICA LTDA,PE,7432632633.5199995,5256458.722432815,15404095.38715766
IBBCA 2008 GESTÃO EM SAÚDE LTDA,RJ,7402586955.45,6504909.451186292,18259634.260054484
HBC SAÚDE LTDA.,SP,7401253889.3,5527448.759746079,16614233.071930036
UNIMED REGIONAL SUL GOIAS COOP. DE TRABALHO MÉDICO LTDA,GO,7400233147.35,3698267.4399550227,10005739.34033074
UNIMED DE PARANAVAÍ COOPERATIVA DE TRABALHO MÉDICO,PR,7395201070.73,3305856.5358649977,10143591.793689163
ASSOCIAÇÃO DE ASSISTÊNCIA À SAÚDE DA AMAGIS,MG,7360945306.63,5623334.840817418,16516835.0795056
UNIMED DE PARANAGUÁ COOPERATIVA DE TRABALHO MÉDICO,PR,7341437621.0,3719066.6773049645,11394562.336624099
UNIMED DE LINS - COOPERATIVA DE TRABALHOS MÉDICOS,SP,7333753923.92,2509840.4941546884,8496654.965928253
UNIMED ALTO DA SERRA - SOCIEDADE COOPERATIVA DE SERVIÇO MÉDICO LTDA.,RS,7241371760.59,2652517.1284212456,9531712.493256252
AMHE MED ASSISTENCIA A SAUDE LTDA - EPP,SP,7239251123.87,5722728.161162055,15914170.829639588
UNIMED DE ASSIS COOPERATIVA DE TRABALHO MÉDICO,SP,7124589789.05,2800546.300727201,9750810.184990242
UNIMED FRONTEIRA NOROESTE/RS - COOPERATIVA DE ASSISTÊNCIA À SAÚDE LTDA.,RS,7081760531.08,2301514.6347351316,8015871.894152796
UNIMED ITABIRA COOPERATIVA DE TRABALHO MÉDICO,MG,7075949792.57,3675818.0740623376,10362897.22876348
UNIMED ITAÚNA COOPERATIVA DE TRABALHO MÉDICO LTDA.,MG,7024034374.21,3173987.5165883414,9850574.983258242
FUNDAÇÃO DE SEGURIDADE SOCIAL DA ARCELORMITTAL BRASIL - FUNSSEST,ES,7020681221.34,11215145.720990416,20248470.844416887
ASSOCIAÇÃO MINEIRA DE ASSISTÊNCIA À SAÚDE DOS MEMBROS DO MINISTÉRIO PÚBLICO,MG,6931897492.2,8232657.35415677,22416237.251691595
ELOSAÚDE - ASSOCIAÇÃO DE ASSISTÊNCIA À SAÚDE,SC,6927737711.43,4615414.864377082,12604022.322344504
UNIMED ITAJUBA COOPERATIVA DE TRABALHO MEDICO,MG,6847401935.440001,3249834.805619364,9839136.114836344
COOPERATIVA DE TRABALHO MEDICO REGIÃO DO PLANALTO SERRANO,SC,6820704236.33,2789654.084388548,8661929.034502093
UNIMED JOÃO MONLEVADE COOPERATIVA DE TRABALHO MÉDICO LTDA.,MG,6817021633.2,3478072.2618367346,11254164.716758173
UNIMED APUCARANA COOPERATIVA DE TRABALHO MÉDICO,PR,6745176655.19,3565103.9403752643,10358824.982810687
UNIMED DE SOBRAL SOCIEDADE COOPERATIVA MÉDICA LTDA,CE,6719897649.24,4285649.010994898,10340866.808941955
UNIMED EXTREMO SUL COOPERATIVA DE TRABALHO MÉDICO,BA,6700618379.15,3265408.5668372316,10181338.282259738
AGROS - INSTITUTO UFV DE SEGURIDADE SOCIAL,MG,6694187191.89,4809042.522909483,12842127.071213966
AFFIX ADMINISTRADORA DE BENEFÍCIOS LTDA,SP,6671539710.53,5634746.377136824,12394288.94160243
GOCARE PLANOS DE SAUDE LTDA,SP,6650577811.2,4310160.603499676,10422507.78292778
UNIMED DE SÃO ROQUE - COOPERATIVA DE TRABALHO MÉDICO,SP,6642574480.99,2679537.910847116,9076430.30700196
CAIXA DE ASSISTÊNCIA DOS EMPREGADOS DA SANEAGO,GO,6624470561.28,7255718.029879518,16305993.319512194
VIVACOM PLANOS DE SAÚDE,GO,6579742848.38,4153878.0608459595,12421749.256497184
UNIMED INCONFIDENTES COOPERATIVA DE TRABALHO MÉDICO LTDA.,MG,6567778410.09,2788865.5669171973,9669712.265937647
INSTITUIÇÃO BENEFICENTE CEL MASSOT - IBCM,RS,6528367646.37,4517901.485377163,11230256.301870238
ASSOCIAÇÃO DA SANTA CASA SAÚDE DE RIBEIRÃO PRETO,SP,6526656368.87,4276970.097555701,12905897.710361509
CAIXA DE ASSISTÊNCIA DOS EMPREGADOS DO SISTEMA FINANCEIRO BANESTES,ES,6501067387.33,5163675.446648133,14472994.619214274
SELECT OPERADORA DE PLANO DE SAUDE LTDA,GO,6487184166.78,4990141.666753846,16084217.514121026
ASSOCIAÇÃO BENEFICENTE CATÓLICA,MG,6479914443.15,4067742.902165725,10201385.868788393
UNIMED BARBACENA - COOPERATIVA DE TRABALHO MÉDICO LTDA,MG,6468719392.84,3035532.328878461,9061670.05674587
UNIMED ALTO VALE - COOPERATIVA DE TRABALHO MÉDICO,SC,6461173484.78,2682097.7520880033,8005896.823040009
UNIMED DE BARRA MANSA SOC. COOP. SERV.MED.E HOSPIT.,RJ,6407314795.07,3452217.0232058186,10675047.393194033
UNIMED NORTE DO PARANÁ COOPERATIVA REGIONAL DE TRABALHO MÉDICO,PR,6400615149.17,2776839.5441084597,8369998.713786627
POLICLIN SAÚDE S/A.,SP,6304422159.67,4632198.500859662,16371866.013747467
UNIODONTO DE CAMPINAS COOPERATIVA ODONTOLÓGICA,SP,6227838532.41,3767597.418275862,11484461.861697596
UNIMED DE CATALÃO COOPERATIVA DE TRABALHO MÉDICO,GO,6208013085.7,2291625.354632706,7822672.996856913
ASSOCIAÇÃO SÃO FRANCISCO VIDA,SP,6185343946.62,3870678.314530663,13315824.585265469
HOSPITAIS E CLÍNICAS DO PIAUÍ S/S LTDA,PI,6121238916.72,3969675.0432684827,11380986.380064754
FUNDAÇÃO LIBERTAS DE SEGURIDADE SOCIAL,MG,6058512006.37,5448302.164001798,16524331.296291525
CAIXA DE ASSISTÊNCIA À SAUDE DOS EMPREGADOS DA CODEVASF - CASEC,DF,6050578815.08,5729714.787007576,16328247.491639782
ESMALE ASSISTENCIA INTERNACIONAL DE SAUDE LTDA.,AL,6049105517.31,4913976.862152722,11225488.541814776
CAIXA DE ASSISTÊNCIA DOS EMPREGADOS DO BANESE,SE,6019710592.64,5280447.888280702,14715598.615118489
UNIMED CENTRO PAULISTA - FEDERAÇÃO INTRAFEDERATIVA DAS COOPERATIVAS MÉDICAS,SP,6013880174.63,3837830.3603254627,10894709.504668472
UNIMED VERTENTE DO CAPARAÓ - COOPERATIVA DE TRABALHO MÉDICO LTDA,MG,5957631054.22,3069361.697176713,10296318.054336768
UNIMED LAVRAS COOPERATIVA DE TRABALHO MÉDICO,MG,5849791198.5199995,2491393.185059625,7353670.543805839
OESTE SAÚDE ASSISTÊNCIA A SAÚDE SUPLEMENTAR S.A,SP,5848593790.34,3994941.113620219,11030644.290800074
FUNDAÇÃO FIAT SAÚDE E BEM ESTAR,MG,5846162645.63,5271562.349531109,11519144.042519197
CAIXA ASSISTENCIAL E BENEFICENTE DOS FUNCIONÁRIOS DA ACARESC,SC,5844144649.08,4794212.181361772,13055921.731831824
UNIMED SUL PAULISTA - COOPERATIVA DE TRABALHO MÉDICO,SP,5810916508.67,1819892.4236360788,6223150.952378616
ELETROS SAÚDE - ASSOCIAÇÃO DE ASSISTÊNCIA À SAÚDE,RJ,5782298136.13,4043565.1301608393,11061944.605028627
UNIMED DE GUARATINGUETA-COOPERATIVA DE TRABALHO MÉDICO,SP,5780413798.0,2658883.9917203314,7643825.736403824
UNIMED CENTRO SUL FLUMINENSE COOPERATIVA DE TRABALHO MÉDICO,RJ,5761956335.78,2468704.5140445586,7744976.0660904255
UNIMED DE AVARÉ COOPERATIVA DE TRABALHO MÉDICO,SP,5686054339.49,2615480.3769503217,7615553.693686003
PLAMED PLANO DE ASSISTENCIA MEDICA LTDA,SE,5633591845.28,5396160.771340996,12806760.801259147
ASSOCIAÇÃO BENEFICENTE DE ASSISTÊNCIA A SAÚDE DOS JUÍZES DO TRABALHO DA 15ª REGIÃO (ABAS 15),SP,5598709030.71,5819863.857286902,15409988.19585754
UNIMED CABO FRIO COOPERATIVA TRABALHO MÉDICO LTDA.,RJ,5589517931.06,2805982.897118474,7696399.6679641465
PRONTOMED PLANOS DE SAÚDE LTDA,MG,5587018797.55,3656425.9146269634,10739423.147510132
HOSPITAL CESAR LEITE,MG,5580312004.56,4332540.37621118,9666664.502715047
PREVIDENT ASSISTÊNCIA ODONTOLÓGICA S.A,SP,5578310763.56,5189126.291683721,12162231.026875377
CAIXA DE ASSISTÊNCIA DOS MAGISTRADOS DE PERNAMBUCO,PE,5557523708.52,3434810.6974783684,11740152.03624057
ODONTO EMPRESAS CONVENIOS DENTARIOS LTDA.,SP,5534945398.42,4767394.830680448,12252958.15221475
UNIMED VILHENA - COOPERATIVA DE TRABALHO MEDICO LTDA,RO,5503532348.37,2802205.880025458,7219862.135073342
SAÚDE SANTA TEREZA LTDA.,SP,5475171396.93,3647682.4763024654,10502819.729365975
UNIMED VIÇOSA - COOPERATIVA DE TRABALHO MÉDICO,MG,5472141771.03,2723813.7237580884,8436124.130482852
UNIMED OESTE DO PARANA - COOPERATIVA DE TRABALHO MEDICO,PR,5464828960.52,2407413.638995595,8258822.401680489
UNIMED ALFENAS COOPERATIVA DE TRABALHO MEDICO,MG,5462238932.15,2669715.9981182795,8219001.15211125
SISTEMAS E PLANOS DE SAÚDE LTDA.,SP,5384305533.78,3261238.9665536038,9465322.685287336
UNIMED REGIONAL DE TRES LAGOAS COOPERATIVA DE TRABALHO MÉDICO,MS,5345866812.12,2675609.015075075,7650955.7387937745
SULMED - ASSISTÊNCIA MÉDICA LTDA,RS,5340714990.83,3064093.511663798,9544922.381423997
CENTRO HOSPITALAR ATIBAIA LTDA.,SP,5333172358.79,4325362.8214030815,13100840.716125345
UNIMED OS BANDEIRANTES COOPERATIVA DE TRABALHO MÉDICO,SP,5317040759.24,2262570.5358468085,7180472.885486786
UNIMED FEDERAÇAO DO ESTADO DO MATO GROSSO,MT,5310241162.69,6160372.578526681,15909303.16624866
CAIXA DE ASSISTÊNCIA DOS SERVIDORES FAZENDÁRIOS ESTADUAIS,CE,5305483071.69,3906835.8407142856,12213561.250976933
UNIMED MARQUES DE VALENÇA COOPERATIVA DE TRABALHO MÉDICO LTDA.,RJ,5290804339.7,2967360.818676388,8323329.207086884
ASSOCIAÇÃO SANTA CASA SAÚDE DE ARAÇATUBA,SP,5284229991.75,3522819.9945,10083247.229606098
UNIMED NORTE PIONEIRO - COOPERATIVA DE TRABALHO MÉDICO,PR,5281887513.63,2327848.177007492,7141578.142066015
PARANA ASSISTENCIA MEDICA LTDA,PR,5242165420.8,2998950.4695652174,8784868.423755761
UNIMED DE CAPIVARI -COOPERATIVA DE TRABALHO MÉDICO,SP,5187005999.93,1700657.7048950822,5573959.379464043
CAIXA DE ASSISTÊNCIA AOS MEMBROS DA DEFENSORIA PÚBLICA DO ESTADO DO RIO DE JANEIRO,RJ,5176291592.65,3903688.9838989438,11810271.75126134
UNIMED MURIAÉ COOPERATIVA DE TRABALHO MEDICO LTDA,MG,5162928345.03,3372258.879836708,8836511.495430136
UNIMED DE UBA COOPERATIVA DE TRABALHO MEDICO,MG,5119405361.19,2566117.975533834,7289047.557353828
UNIMED ALTA MOGIANA COOPERATIVA DE TRABALHO MÉDICO,SP,5115209862.28,2148345.175254095,6895488.923683715
UNIMED EXTREMO OESTE CATARINENSE COOPERATIVA DE TRABALHO MÉDICO,SC,5099491229.51,2154411.16582594,6697328.49849201
UNIMED ITUIUTABA COOPERATIVA TRABALHO MÉDICO LTDA.,MG,5075614243.59,2411218.167976247,7390935.834411197
UNIMED NOROESTE DO PARANÁ COOP DE TRABALHO MÉDICO .,PR,5067630271.09,2206195.1550239446,7090418.198761331
UNIMED GUAXUPÉ COOPERATIVA DE TRABALHO MEDICO,MG,4970131870.22,2303119.495004634,6533681.60911746
ASSISTÊNCIA MÉDICA SÃO MIGUEL LTDA,SP,4967616528.51,3970916.489616307,11807384.414149197
SANTA CASA DA MISERICÓRDIA DE SÃO JOÃO DEL REI,MG,4951873119.64,4873890.865787402,11325403.597155882
UNIMED PATROCÍNIO COOPERATIVA DE TRABALHO MÉDICO LTDA.,MG,4904692511.2,2823657.173978123,7417418.5078899115
UNIMED COSTA VERDE RJ,RJ,4833080006.69,2620976.142456616,6940812.337151867
UNIMED TRÊS CORAÇÕES COOPERATIVA DE TRABALHO MÉDICO LTDA.,MG,4758199756.73,2205934.0550440424,6001083.3166440865
SANTA CASA DE MAUÁ SAÚDE,SP,4679800632.38,5153965.454162995,13900627.684929835
CAIXA DE ASSISTÊNCIA À SAÚDE DO SINDICATO DOS FUNCIONÁRIOS INTEGRANTES DO GRUPO OCUPACIONAL ADMINISTRAÇÃO TRIBUTÁRIA DO ESTADO DE PERNAMBUCO,PE,4658471493.62,3420316.808825257,9979264.948471276
OPERADORA UNICENTRAL DE PLANOS DE SAÚDE LTDA.,SP,4655437915.53,3508242.5889449883,9865332.603479689
TEMPO MED PLANO DE SAUDE LTDA,SC,4523227246.32,3318581.985561262,9209262.456169626
UNIMED DE BARRETOS COOPERATIVA DE TRABALHO MÉDICO,SP,4497959632.91,2762874.4673894346,7267013.027915245
GARANTIA DE SAÚDE LTDA,SP,4487919902.96,3349193.957432836,10005238.971184896
UNIMED NOROESTE DE MINAS COOPERATIVA DE TRABALHO MEDICO LTDA,MG,4443303785.96,2231694.518312406,7956171.573946661
UNIMED DE SAO JOSÉ DO RIO PARDO-COOP. DE TRAB. MÉDICO,SP,4432537137.9800005,2512776.1553174607,7131980.321474678
UNIMED SÃO SEBASTIÃO DO PARAÍSO COOPERATIVA DE TRABALHO MÉDICO,MG,4425765580.36,2397489.480151679,6722033.092983338
UNIMED GURUPI COOPERATIVA DE TRABALHO MÉDICO,TO,4400932618.77,1580227.15216158,4933426.591730468
UNIMED DE LENÇOIS PAULISTA - COOPERATIVA DE TRABALHO MÉDICO,SP,4371617166.95,1978107.3153619908,6525290.333049471
ASSOCIAÇÃO MAIS SAÚDE SANTA CASA DE SÃO JOÃO DA BOA VISTA,SP,4363641019.52,3189796.0669005853,8921793.344015993
BRASILDENTAL OPERADORA DE PLANOS ODONTOLÓGICOS S.A.,SP,4356425674.42,3105078.8841197435,9483159.542803057
UNIMED DE IBITINGA COOPERATIVA DE TRABALHO MÉDICO,SP,4353299406.78,2209796.653187817,6653440.866800548
SANTA CASA DE MISERICÓRDIA DE TUPÃ,SP,4342321125.37,4523251.172260417,9576070.853370145
COOPERATIVA DE TRABALHO MÉDICO DO PLANALTO NORTE DE SANTA CATARINA LTDA,SC,4321902507.91,1863692.3276886588,5991130.9038968375
UNIMED DE LORENA COOPERATIVA DE TRABALHO MÉDICO,SP,4315119128.5,1881866.1703009158,5159958.417306485
UNIMED INTRAFEDERATIVA FEDERAÇÃO REGIONAL SUL DE MINAS,MG,4306143626.37,2687979.791741573,7272353.92767484
UNIMED ARAGUARI COOPERATIVA DE TRABALHO MÉDICO ,MG,4303261828.38,2093026.1811186771,7127017.052788991
UNIMED TRÊS RIOS COOPERATIVA DE TRABALHO MÉDICO,RJ,4237720745.63,2306870.302465977,6780703.599839074
UNIMED PLANALTO CENTRAL/RS - COOPERATIVA DE ASSISTÊNCIA  À SAÚDE LTDA.,RS,4212292139.65,1695769.782467794,5651103.083981308
SAMOC S.A. - SOCIEDADE ASSISTENCIAL MÉDICA E ODONTO CIRÚRGICA,RJ,4200164611.85,2774217.048778071,8314905.164590669
CAIXA DE ASSISTÊNCIA DOS FUNCIONÁRIOS DO BANCO DA AMAZÔNIA - CASF,PA,4168057317.63,2670119.9984817426,7548836.411047049
ASSOCIAÇÃO POLICIAL DE ASSISTÊNCIA À SAÚDE,SP,4133732445.4,1330029.7443371944,4037385.1931364536
IRMANDADE DE MISERICÓRDIA DO HOSPITAL DA SANTA CASA DE MONTE ALTO,SP,4113916570.25,2831325.9258430833,6845330.369474722
UNIODONTO DE SÃO JOSÉ DOS CAMPOS COOPERATIVA DE TRABALHO ODONTOLÓGICO,SP,4072073430.03,2749543.16679946,6639592.44711474
"UNIMED VALE DAS ANTAS, RS - COOPERATIVA DE ASSISTÊNCIA À SAÚDE LTDA.",RS,4056712662.59,1476779.2728758645,5077126.09797825
SAÚDE BRASIL ASSISTÊNCIA MÉDICA LTDA.,SP,4048875463.05,4123091.1029022406,8585612.6400538
CAIXA ASSISTENCIAL UNIVERSITÁRIA DO RIO GRANDE DO NORTE,RN,4019133684.56,2988203.482944238,8861581.170467256
UNIMED DE BIRIGUI - COOPERATIVA DE TRABALHO MÉDICO,SP,4010498859.25,1666874.006338321,5226590.440282934
BENEVIX ADMINISTRADORA DE BENEFÍCIOS LTDA,ES,3988001302.12,2967262.8736011903,7102939.331333658
LEADER ASSISTÊNCIA MÉDICA E HOSPITALAR LTDA.,SP,3940672500.97,3546959.9468676867,9160905.45790363
SANTA CASA DE MISERICORDIA HOSPITAL SÃO VICENTE,SP,3906239358.44,3046988.579126365,7081999.408943825
UNIMED DE TAUBATÉ COOPERATIVA DE TRABALHO MÉDICO,SP,3906149948.45,1635741.1844430484,4873180.063781338
IRMANDADE DE MISERICORDIA DE PORTO FERREIRA,SP,3890971494.77,2945474.257963664,6890255.336927749
UNIMED NORTE PAULISTA - COOPERATIVA DE TRABALHO MÉDICO,SP,3871348929.14,1752534.5989769127,5562175.47088852
UNIMED DE MINEIROS COOPERATIVA DE TRABALHO MÉDICO ,GO,3849345608.93,1466976.2229153963,5478614.713675806
UNIMED CAÇADOR COOPERATIVA DE TRABALHO MÉDICO DA REGIÃO DO CONTESTADO,SC,3816946104.13,2128804.2967819297,6298376.363155398
GS PLANO GLOBAL DE SAÚDE LTDA,RJ,3814946235.67,2645593.783404993,7118927.184436136
ASSOCIAÇÃO DOS FUNCIONÁRIOS DO FISCO DO ESTADO DE GOIÁS,GO,3656868505.85,2977905.949389251,7320577.634010172
ASSOCIAÇÃO DO PLANO DE SAÚDE DA SANTA CASA DE MISERICÓRDIA DE ITABUNA - PLANSUL,BA,3652577365.77,2548902.5581088625,6873299.75532096
UNIMED VALE DO PIQUIRI-COOPERATIVA DE TRABALHO MÉDICO VALE DO PIQUIRI ,PR,3644002182.51,1582972.2773718506,5105741.229950882
BEST SENIOR OPERADORA DE SAÚDE LTDA,ES,3618031421.01,2652515.704552786,9269560.9233488
COOPERATIVA DE TRABALHO MEDICO DE ARAGUAÍNA - UNIMED ARAGUAÍNA,TO,3614697669.45,1196127.620598941,4327309.2935467595
UNIMED DO OESTE DA BAHIA COOPERATIVA DE TRABALHO MÉDICO,BA,3591588909.23,2336752.7060702667,7379056.847602118
AMAZÔNIA PLANOS DE SAÚDE LTDA,PA,3576807383.7599998,3112974.2243342036,8099838.20217214
UNIMED REGIÃO DA CAMPANHA/RS - COOPERATIVA DE ASSISTÊNCIA À SAÚDE LTDA.,RS,3564410047.48,1224462.4003710065,4086389.680236532
UNIMED TRÊS PONTAS - COOPERATIVA DE TRABALHO MÉDICO,MG,3547375398.86,1597916.8463333333,4747885.597331512
UNIMED DE ANDRADINA - COOPERATIVA DE TRABALHO MÉDICO,SP,3521925695.52,1673123.8458527315,4875679.532403068
ASSOCIAÇÃO SAÚDE SÃO JOSÉ,SC,3518263076.81,2527487.8425359195,6825826.670556322
SANTA CASA DE MISERICÓRDIA E ASILO DOS POBRES DE BATATAIS,SP,3476575165.48,2063249.3563679524,4747213.17244237
MATÃO CLINICAS & AMHMA SAÚDE LTDA,SP,3442101253.21,2290153.8610844975,7002776.596250515
ADVANCE PLANOS DE SAÚDE LTDA,SP,3402759042.79,3008628.6850486295,7498432.8627878865
ASSOCIAÇÃO SÃO LUIZ SAÚDE,SP,3376524911.9900002,3363072.621503984,9337347.159647714
UNIMED CATAGUASES COOPERATIVA DE TRABALHO MÉDICO LTDA,MG,3363334797.22,1457882.4435283917,4360151.0583095215
TERRAMAR ADMINISTRADORA DE PLANO DE SAUDE LTDA,BA,3353431588.52,2538555.3281756244,6099505.457873801
UNIMED DE REGISTRO COOPERATIVA DE TRABALHO MÉDICO,SP,3322061742.55,2319875.518540503,5523026.369682298
CAIXA DE ASSISTÊNCIA DOS EMPREGADOS DO BANEB,BA,3307693605.46,2362638.289614286,6515579.459281407
AMHA SAUDE S/A,SP,3300935297.4,2701256.380851064,7494675.323939261
SÃO DOMINGOS SAÚDE- ASSISTÊNCIA MÉDICA  LTDA,SP,3299198108.69,2014162.4595177046,6188927.14086415
NOVA SAÚDE OPERADORA INTEGRADA DE SAÚDE LTDA,RJ,3289361218.47,3156776.60121881,10260693.410587542
UNIMED DE DRACENA - COOPERATIVA DE TRABALHO MÉDICO,SP,3260814897.18,1378780.0833742071,4035473.6587360944
UNIMED NOROESTE FLUMINENSE - COOPERATIVA DE TRABALHO MÉDICO LTDA,RJ,3241116278.54,2628642.561670722,6515757.070642998
UNIMED CARATINGA - COOPERATIVA DE TRABALHO MÉDICO LTDA,MG,3205777771.28,1690811.0608016879,4923464.429994954
ÚNICA ASSISTENCIA MEDICA LTDA ,SP,3142777798.79,4124380.3133727033,9742530.31007907
UNIMED DE TUPA COOPERATIVA DE TRABALHO MÉDICO,SP,3113322597.98,1111900.92785,3808271.909874061
SBC SAÚDE LTDA.,SP,3096027538.66,2843000.4946372816,6219555.558293458
ASSOCIAÇÃO POLICIAL DE ASSISTÊNCIA À SAÚDE DE BAURU,SP,3067955403.06,2265845.940221566,6691902.500073787
UNIMED PONTAL DO TRIÂNGULO - COOPERATIVA DE TRABALHO MÉDICO,MG,3062630479.25,1406812.3469223701,4370727.605690878
CARE PLUS ODONTOLOGIA ASSISTENCIAL LTDA.,SP,3062263027.23,2122150.40002079,6385664.86417075
ASSOCIAÇÃO PARANAENSE DE ASSISTÊNCIA À SAUDE DOS MEMBROS DO MINISTERIO PUBLICO DO PARANÁ,PR,3045556964.4900002,3687114.969116223,9213134.51647151
PLADISA PLANOS DE SAÚDE SA,SC,3036118637.85,1993511.9092908732,6486716.481668579
UNIMED REGIÃO DA PRODUÇÃO/RS - COOPERATIVA DE ASSISTÊNCIA À SAÚDE LTDA,RS,3026590838.72,1146001.8321544868,3619502.2593940874
ASSOCIAÇÃO DE SAÚDE DO VALE,SC,3020810357.99,2336280.245931941,7254719.0688227555
PRONTOCLINICA E HOSPITAIS SAO LUCAS S/A,MG,2990444951.35,1574747.209768299,4117654.294715425
VITA ASSISTÊNCIA A SAÚDE LTDA.,MG,2952149823.76,1977327.4104219694,5831622.844832893
UNIMED SUDOESTE PAULISTA COOPERATIVA DE TRABALHO MÉDICO,SP,2950967630.11,1677639.3576520751,4200056.514967102
ASSOCIAÇÃO DOS AUDITORES FISCAIS DO ESTADO DA PARAÍBA - AFRAFEP,PB,2914159527.79,1985122.2941348774,6057461.842153891
UNITY SERVIÇOS INTEGRADOS DE SAÚDE LTDA.,DF,2888913538.65,2223951.9158198615,7333097.236613217
PLANO DE SAUDE ASES LTDA.,RJ,2867357342.61,1853495.3733742728,6066309.324709276
ASSOCIAÇÃO SAÚDE CONCEIÇÃO,SC,2837628026.41,2192911.921491499,5933753.320973229
ASSOCIAÇÃO FCA SAÚDE,MG,2834757268.86,2627207.8488044487,6198708.47275658
UNIMED PATOS - COOPERATIVA DE TRABALHO MÉDICO,PB,2788683469.72,1874115.2350268816,5776553.558625945
ASSOCIAÇÃO DE SAÚDE DOS FORNECEDORES DE CANA DE PIRACICABA E REGIÃO,SP,2763900395.82,2295598.335398671,7773202.658684295
UNIMED DE BATATAIS - COOPERATIVA DE TRABALHO MÉDICO,SP,2757112327.24,1534286.2143795213,4360012.57092143
ODONTO SEG OPERADORA DE PLANOS ODONTOLOGICOS S.A.,SP,2707837181.56,3130447.608739884,6660092.39880702
UNIMED VALE DO JAURU COOPERATIVA DE TRABALHO MÉDICO,MT,2699394045.16,1152602.0688129803,4242321.792645697
ATÍVIA SERVIÇOS DE SAÚDE S/A,SP,2685700346.46,2374624.532679045,5734500.328333253
UNIODONTO PORTO ALEGRE COOPERATIVA ODONTOLOGICA LTDA,RS,2668867195.33,2468887.322229417,4642719.004741536
UNIMED DE JATAÍ COOPERATIVA DE TRABALHO MÉDICO LTDA.,GO,2661972045.05,1167019.7479395003,3262259.9921117923
DESBAN - FUNDAÇÃO BDMG DE SEGURIDADE SOCIAL,MG,2617792902.42,2322797.606406389,6347652.04941546
IRMANDADE DA SANTA CASA DE MISERICÓRDIA E MATERNIDADE DONA ZILDA SALVAGNI,SP,2602108971.74,3901212.8511844072,7748546.91956597
ALLCARE ADMINISTRADORA DE BENEFÍCIOS EM SAÚDE LTDA.,DF,2591090986.95,2303191.9883999997,6062152.867615721
AMPARA ASSISTÊNCIA MÉDICA PARAÍSO LTDA,MG,2577060265.41,1588816.4398335388,4351321.305640462
UNIODONTO DE SC COOPERATIVA ADMINISTRADORA DE CONTRATOS,SC,2566891571.4,1309638.5568367348,4952697.866164178
ANAFE SAUDE,GO,2526852205.9900002,2696747.284941302,7774443.275577208
UNIMED REGIÃO DA FRONTEIRA - RS COOPERATIVA DE ASSISTÊNCIA À SAÚDE LTDA.,RS,2513709042.3,1209677.1137151108,3267928.432410816
