RazaoSocial,UF,Total_Despesas,Media_Despesas,Desvio_Padrao
SMART CARE SISTEMAS MÉDICOS E ODONTOLÓGICOS LTDA.,SP,111180550.53,265347.3759665871,560165.7946237319
LEXUS ADMINISTRADORA DE BENEFICIOS LTDA,SP,100861221.1,124828.24393564355,270178.23219351197
BEMSTAR ASSISTENCIA MEDICA LTDA,BA,96414985.17,136758.84421276595,241381.03136788044
FOX SAÚDE ASSISTÊNCIA MÉDICA INTEGRADA LTDA,PE,96081016.64,980418.5371428571,1311774.3881956225
NEXO - ADMINISTRADORA DE BENEFICIOS LTDA,SP,93123899.63,134184.2934149856,342005.0294772256
VIVER SAUDE LTDA,RN,91348544.96,524991.6377011493,907589.89260038
FEBRAFITE SAUDE,DF,86528203.04,293315.9425084746,502520.1921253468
LIFE CLASS ADMINISTRADORA DE BENEFICIOS LTDA.,SP,83494230.32,131694.36958990534,258533.88897939687
ESPLENDOR ADMINISTRADORA DE BENEFÍCIOS LTDA.,DF,83240384.17,119598.2531178161,264776.52559658646
SALVE SAÚDE ADMINISTRADORA DE BENEFÍCIOS LTDA,RJ,71573261.25,131327.08486238532,418011.6948368448
VCT PLANOS DE SAUDE LTDA,MG,69621009.37,186651.49965147456,379740.06560344546
HEALTH ADMINISTRADORA DE BENEFICIOS LTDA,SP,60672151.41,171875.78303116147,349767.8298748715
MAXIMED PLANOS DE SAUDE LTDA,RJ,58366560.88,422946.0933333334,914663.1001388311
SANUS ADMINISTRADORA DE BENEFÍCIOS LTDA,ES,57792461.800000004,159647.68453038676,434470.97537384066
EGRÉGORA  ADMINISTRADORA DE BENEFICIOS S/A,ES,53868333.92,177198.46684210526,374064.2853680996
SAUDE SALV ASSISTENCIA MEDICA LTDA,RO,50689112.1,173592.84965753424,366604.2706056126
UNIC ASSISTENCIA MEDICA LTDA,SP,49597500.0,1377708.3333333333,1534267.024277624
AP ADMINISTRAÇÃO DE BENEFICIOS - SOCIEDADE SIMPLES UNIPESSOAL LIMITADA,SP,48320130.75,150062.51785714287,377508.3114596791
PLAMEDH PLANOS DE SAÚDE LTDA,MG,47635100.76,595438.7594999999,730573.2018295785
GESTAO VIDA ADMINISTRADORA DE BENEFICIOS LTDA.,SP,47463460.81,110124.03900232019,182323.93901174446
UP SOLUÇÕES EM SAÚDE LTDA ,SP,41938805.6,224271.68770053476,329855.1163045073
ELITE SAUDE SERVICOS MEDICOS LTDA.,SP,40494359.9,323954.87919999997,476742.4494977129
NOVAMED PLANOS DE SAUDE LTDA,GO,35494226.72,1109194.585,1075663.9384756433
BIT LIFE BENEFÍCIOS LTDA,SP,35020151.33,89795.25982051282,135252.9449904861
PRO-SAUDE JARINU ASSISTENCIA MEDICA SUPLEMENTAR LTDA.,SP,32798381.86,156182.77076190477,323911.1336461426
SAUDE INTEGRAL ASSISTENCIA MEDICA LTDA,BA,29997346.2,133321.53866666666,243543.3422801409
VITACARE PLANOS DE SAUDE LTDA,BA,28800275.84,213335.3765925926,259678.50462834907
CLICSAUDE ADMINISTRADORA DE BENEFICIOS LTDA,SP,27756007.61,51977.542340823966,119664.34803734014
INTERVIDA ADMINISTRADORA DE BENEFÍCIOS LTDA,SP,27337539.49,60750.08775555555,138471.2147943529
BEDOIS SERVIÇOS DE ADMINISTRAÇÃO DE BENEFÍCIOS LTDA.,RJ,23837470.93,89278.91734082397,185799.93769204523
SAUDE VIVA ADMINISTRADORA DE BENEFICIOS LTDA,SP,23506426.64,67937.64924855491,141779.17126805685
ATIMED ASSISTENCIA MEDICA LTDA,SP,20979123.18,308516.51735294115,479641.4758083931
ESPERANÇA OPERADORA DE PLANOS DE SAÚDE LTDA,RJ,20805155.52,452285.9895652174,625955.0898455924
UNIÃO HOSPITAIS DE PERNAMBUCO LTDA,PE,20803541.6,452250.90434782614,625964.1784176527
SAUDE FACIL PLANOS DE SAUDE LTDA,RJ,20801994.72,452217.2765217391,625975.1720422498
INTEGRALCARE PLANOS DE SAUDE LTDA,BA,19201672.32,142234.60977777778,165932.64040807032
MEDICAL LIFE PLANOS DE SAÚDE LTDA,BA,18880546.56,242058.2892307692,259801.1640926841
TOTAL SAUDE  ADMINISTRADORA DE BENEFICIOS EIRELI,ES,16951074.0,167832.41584158415,177860.9102648073
LIKE DENTAL PLANOS ODONTOLÓGICOS SS LTDA,PR,15970840.42,46292.29107246377,95139.08928033165
INTEGRA ADMINISTRADORA DE BENEFICIOS LTDA,GO,12957490.14,69663.92548387097,137605.15216358722
AMAZIL ASSISTENCIA MEDICA DO BRASIL LTDA,RJ,12491463.82,52929.93144067797,105856.74728911955
RAMED ADMINISTRADORA DE BENEFICIOS LTDA.,SP,12249940.899999999,50829.63029045642,157953.77675867145
SOCIODONTO PLANO DE ASSISTÊNCIA ODONTOLÓGICA LTDA,MG,12240775.36,23722.432868217053,52696.516764153435
SALUTY ADMINISTRADORA DE BENEFICIOS LTDA,RJ,11366771.12,37390.694473684205,70092.21084437732
VIVER BEM ADMINISTRADORA DE BENEFÍCIOS LTDA,RJ,11341039.33,42796.37483018868,64151.842309889485
