RazaoSocial,UF,Total_Despesas,Media_Despesas,Desvio_Padrao
BRADESCO SAÚDE S.A.,RJ,2571367464285.69,1137269997.4726624,3691103035.215179
SUL AMERICA COMPANHIA DE SEGURO SAÚDE,RJ,2113470247795.5,669455257.4581882,2396832185.292221
AMIL ASSISTÊNCIA MÉDICA INTERNACIONAL S.A.,SP,1742787106092.95,599513968.3842278,2229910109.656595
NOTRE DAME INTERMÉDICA SAÚDE S.A.,SP,1481931697727.59,513134244.36550903,1873899497.3008697
HAPVIDA ASSISTENCIA MEDICA S.A.,CE,1290814551874.4,398153779.1099321,1473342218.9754913
CAIXA BENEFICENTE DOS FUNCIONARIOS DO BANCO DO ESTADO DE SÃO PAULO,SP,587053601699.71,333363771.55009085,1748137771.6169317
UNIMED BELO HORIZONTE COOPERATIVA DE TRABALHO MÉDICO,MG,498273966133.44,107040594.22845113,463659257.3885143
UNIMED NACIONAL - COOPERATIVA CENTRAL,SP,463780489744.52997,136245737.29275262,519869450.19024515
PREVENT SENIOR PRIVATE OPERADORA DE SAÚDE LTDA,SP,406651960378.12,184255532.56824648,641622494.0211459
CAIXA DE ASSISTÊNCIA DOS FUNCIONÁRIOS DO BANCO DO BRASIL,DF,403307657279.04,212378966.4449921,723343399.4878238
PORTO SEGURO - SEGURO SAÚDE S/A,SP,399231778531.88,196859851.34708086,627920771.2644691
UNIMED DO EST. DO RJ FEDERAÇÃO EST. DAS COOPERATIVAS MÉDICAS,RJ,360149395583.98,170606061.38511604,503327824.83559245
UNIMED SEGUROS SAÚDE S/A,SP,335828638172.07,135633537.2261995,505095635.1941001
GEAP AUTOGESTÃO EM SAÚDE,DF,332703183785.77,157157857.24410486,494124996.519967
CLINIPAM CLINICA PARANAENSE DE ASSISTENCIA MEDICA LTDA,CE,272481020275.73,113581083.89984578,522665313.1069448
UNIMED PORTO ALEGRE - COOPERATIVA MÉDICA LTDA.,RS,262934422617.46,84954579.19788691,299424594.6618937
UNIMED CURITIBA - SOCIEDADE COOPERATIVA DE MÉDICOS,PR,208273546440.83,67424262.36349304,246096928.55290782
CARE PLUS MEDICINA ASSISTENCIAL LTDA.,SP,188629086410.84,119385497.72837974,318036492.9269898
UNIMED CAMPINAS - COOPERATIVA DE TRABALHO MÉDICO,SP,184750725763.93,48746893.34140633,207561582.97928303
ODONTOPREV S/A,SP,161620660380.49,71959332.31544523,221330729.48488653
UNIMED DE FORTALEZA SOCIEDADE COOPERATIVA MÉDICA LTDA.,CE,159405570791.7,41447106.29009361,172223374.93313748
ITAUSEG SAÚDE S.A.,SP,156897324181.08,110026174.04002804,364553757.9217896
FUNDAÇÃO SAÚDE ITAÚ,MG,149760482677.65,111511900.72795978,326212808.81781876
OMINT SERVIÇOS DE SAÚDE S.A.,SP,137701448832.51,75082578.42557798,258110924.92873162
SUL AMÉRICA PARANÁ CLÍNICAS SERVIÇOS DE SAÚDE S.A.,SP,133242240159.0,63630487.18194842,239907144.9839673
UNIMED GOIANIA COOPERATIVA DE TRABALHO MÉDICO,GO,132525685391.28,44606423.89474251,176994985.7013624
UNIMED VITORIA COOPERATIVA DE TRABALHO MEDICO,ES,132286947443.92,32890837.256071605,130667604.03779082
SAMEDIL SERVIÇOS DE ATENDIMENTO MÉDICO S/A,ES,130079788589.79001,68283353.59044094,220243850.14175102
FUNDAÇÃO CESP,SP,122746260712.12,97805785.42798406,255934803.24423695
UNIMED DO ESTADO DE SÃO PAULO - FEDERAÇÃO ESTADUAL DAS COOP. MÉDICAS,SP,119809483642.77,42097499.52310963,144582762.6432367
HUMANA SAÚDE NORDESTE LTDA. ,PI,115056109321.07,44015344.04019511,183247887.77408004
SERV  SOCIAL AUTÔNOMO DE ASSIST À SAÚDE DOS SERV PÚBLICOS E MILITARES DE GOIÁS,GO,109091148195.25,95693989.64495614,305082929.0181918
GRUPO HOSPITALAR DO RIO DE JANEIRO LTDA,RJ,107050377610.67,47493512.69328749,179515069.88991982
QUALICORP ADMINISTRADORA DE BENEFÍCIOS S.A.,SP,106352615812.51,63798809.72556088,167423509.9361396
UNIMED RECIFE COOPERATIVA DE TRABALHO MÉDICO,PE,103124068677.52,46327074.877592094,138155657.12772298
UNIMED GRANDE FLORIANÓPOLIS-COOPERATIVA DE TRABALHO MEDICO,SC,95043892536.56,26118134.799824126,95571425.62956947
FUNDAÇÃO SÃO FRANCISCO XAVIER,MG,87904272419.78,38285832.93544425,110039186.86001109
NOTRE DAME INTERMÉDICA MINAS GERAIS SAÚDE S.A.,CE,86640023396.36,34218018.71894155,115319558.87089391
UNIMED BELÉM COOPERATIVA DE TRABALHO MÉDICO,PA,85739454870.58,37164913.2512267,128308499.99735959
UNIMED NATAL SOC. COOP. DE TRAB. MÉDICO,RN,83729292784.81,31022338.934720267,107032587.50424056
UNIMED SAO JOSÉ DO RIO PRETO - COOP. DE TRABALHO MÉDICO,SP,82656189188.06,22279296.27710512,89935832.03346232
UNIMED DE LONDRINA COOPERATIVA DE TRABALHO MÉDICO,PR,81491124534.18,26245128.674454104,90779314.45477694
ASSOCIAÇÃO PETROBRAS DE SAÚDE - APS,RJ,79750439605.39,65476551.40015599,209682012.08598638
SANTA HELENA ASSISTÊNCIA MÉDICA S/A.,SP,79181676088.51,38086424.28499759,132508273.84665711
UNIMED SOROCABA COOPERATIVA DE TRABALHO MÉDICO,SP,77522816407.16,33676288.62170287,101828165.0231388
UNIMED CUIABA COOPERATIVA DE TRABALHO MÉDICO,MT,76567920823.18,18803516.901566796,81312665.83562851
SAMP ESPIRITO SANTO ASSISTENCIA MEDICA SA,ES,76328850077.7,27309069.7952415,99126127.51762249
BRADESCO SAÚDE - OPERADORA DE PLANOS  S/A,SP,76258058464.02,60045715.326000005,211808462.4327966
UNIMED SERRA GAUCHA/RS COOPERATIVA DE ASSISTENCIA A SAUDE LTDA,RS,73109436071.45,19459525.172065478,76562702.99805291
CAIXA DE ASSISTENCIA DOS SERVIDORES DO ESTADO DE MATO GROSSO DO SUL,MS,72162548819.92,43867810.83277811,118564306.2710956
UNIMED REGIONAL MARINGÁ COOP.DE TRABALHO MÉDICO,PR,67860666337.49,18704704.062152702,70081264.32182658
UNIMED-SÃO GONÇALO - NITERÓI - SOC.COOP.SERV.MED E HOSP LTDA,RJ,66085404588.13,24816148.925321065,77285975.30218397
FUNDAÇÃO ASSISTENCIAL DOS SERVIDORES DO MINISTÉRIO DA FAZENDA,DF,65409373790.8,36808876.64085538,136491836.71874803
UNIMED DE BAURU COOPERATIVA DE TRABALHO MÉDICO,SP,64399026548.53,18991160.881312296,68559974.24572027
CAIXA DE ASSISTÊNCIA DOS EMPREGADOS DO BANCO DO ESTADO DO RIO GRANDE DO SUL,RS,60310582536.19,36662968.10710639,156260061.00109828
UNIMED DE RIBEIRAO PRETO - COOPERATIVA DE TRABALHO MÉDICO,SP,60248677116.38,24205977.145994373,74565927.10541932
UNIMED LITORAL COOPERATIVA DE TRABALHO MÉDICO LTDA,SC,59642861988.21,18586120.90626675,64334241.45168445
SINDIFISCO NACIONAL - SINDICATO NACIONAL DOS AUDITORES-FISCAIS DA RECEITA FEDERAL DO BRASIL,DF,59369357103.02,32746473.857153885,96863892.05429049
UNIMED CAMPO GRANDE MS COOPERATIVA DE TRABALHO MÉDICO,MS,58651271118.1,20365024.69378472,69426436.82143295
UNIMED MACEIO COOPERATIVA DE TRABALHO MÉDICO,AL,58627208958.39,22073497.348791417,76337632.32751365
UNIMED DO ESTADO DO PARANÁ FEDERAÇÃO ESTADUAL DAS COOPERATIVAS MÉDICAS,PR,57375920384.33,22950368.153732,71138229.4205292
UNIMED-RIO COOPERATIVA DE TRABALHO MEDICO DO RIO DE JANEIRO,RJ,55710519693.2,84282178.05325264,279237058.6651181
UNIMED JOAO PESSOA - COOPERATIVA DE TRABALHO MÉDICO,PB,54234576897.590004,23276642.4453176,84920372.32920377
ASSOCIAÇÃO DE BENEFICÊNCIA E FILANTROPIA SÃO CRISTOVÃO,SP,52763874039.31,24865162.12974081,75542866.2819913
UNIMED DO BRASIL - CONF. NACIONAL DAS COOPERATIVAS MÉDICAS,SP,52006574406.67,34080323.98864351,101701840.84662355
POSTAL SAÚDE CAIXA DE ASSISTÊNCIA E SAÚDE DOS EMPREGADOS DOS CORREIOS,DF,51645126160.659996,34315698.44562126,129714849.90350667
UNIMED DO ESTADO DE SANTA CATARINA FED. EST. DAS COOP. MÉD.,SC,51622472764.69,17776333.596656337,60395659.698326394
ASSOCIAÇÃO BENEFICENTE DOS PROFESSORES PÚBLICOS ATIVOS E INATIVOS DO RIO DE JANEIRO - APPAI,RJ,50302340063.03,42485084.512694255,125850810.36260056
UNIMED DE SANTOS COOP DE TRAB MEDICO,SP,50224377832.25,17118056.52087594,63836622.06671546
CENTRO TRASMONTANO DE SAO PAULO,SP,49198737813.02,36715475.97986567,103039748.29693562
UNIMED DE JOINVILLE COOPERATIVA DE TRABALHO MÉDICO,SC,49187755883.03,21939230.991538804,64700526.05895412
UNIMED BLUMENAU - COOPERATIVA DE TRABALHO MEDICO,SC,49052954279.02,17067833.778364647,57130672.54333904
CENTRO CLÍNICO GAÚCHO LTDA,CE,48802659127.03,21594096.95886283,66468975.562749304
H.B. SAÚDE S/A.,SP,48565669553.82,28771131.252263032,121366358.49573599
UNIMED DE PIRACICABA SOCIEDADE COOPERATIVA DE SERVIÇOS MÉDICOS,SP,47541131564.1,12435556.255323045,47708103.94244959
CEMIG SAÚDE,MG,46750681363.92,33852774.34027516,101271885.51983048
UNIMED DE CIANORTE - COOPERATIVA DE TRABALHO MEDICO ,PR,46260926423.15,23423253.88513924,554757317.9215208
UNIMED VALE DO SINOS - COOPERATIVA DE ASSISTÊNCIA À SAÚDE LTDA,RS,45465918048.94,14605177.65786701,51211476.240804866
UNIMED JUIZ DE FORA COOPERATIVA DE TRABALHO MÉDICO LTDA,MG,43332152358.96,13879613.183523383,46362041.67554506
UNIMED CHAPECÓ - COOPERATIVA DE TRABALHO MÉDICO DA REGIÃO OESTE CATARINENSE,SC,43093679496.23,15750613.850961259,47872787.31228094
UNIMED DIVINOPOLIS - COOPERATIVA DE TRABALHO MEDICO LTDA,MG,42320471927.57,16365225.029996132,54217383.16628801
UNIMED DE MANAUS COOP. DO TRABALHO MÉDICO LTDA,AM,42301924600.19,21267935.947807945,59948225.27434532
UNIMED UBERLÂNDIA COOPERATIVA REGIONAL TRABALHO MÉDICO LTDA,MG,41383525178.02,11190785.607901568,47015103.280919485
UNIMED NOVA IGUACU COOPERATIVA DE TRABALHO MEDICO,RJ,40097968071.79,17092058.001615517,51273348.20350433
UNIMED - COOPERATIVA DE SERVIÇOS DE SAÚDE DOS VALES DO TAQUARI E RIO PARDO LTDA.,RS,39157477038.82,12570618.632044943,45213443.812777266
UNIMED SAO JOSE DOS CAMPOS - COOPERATIVA DE TRABALHO MEDICO,SP,38559030811.06,10590230.928607525,42480862.39492279
"SERVIÇO SOCIAL DA INDÚSTRIA DO PAPEL, PAPELÃO E CORTIÇA DO ESTADO DE SÃO PAULO - SEPACO",SP,38306594463.38,30793082.36606109,73290917.31679595
UNIMED DE CASCAVEL COOPERATIVA DE TRABALHO MÉDICO,PR,37382140177.41,10386813.052906364,39840180.61723908
UNIMED DE VOLTA REDONDA COOPERATIVA DE TRABALHO MÉDICO,RJ,37376835005.37,11907242.754179675,39281928.628505625
PASA - PLANO DE ASSISTENCIA A SAUDE DO APOSENTADO DA VALE,RJ,36304942731.9,20327515.52737962,60334484.16870248
ECONOMUS INSTITUTO DE SEGURIDADE SOCIAL,SP,35703665118.95,28201947.171366505,87674024.16072267
ALICE OPERADORA LTDA.,SP,35230930963.29,28050104.27013535,72309521.51389395
LEVE SAUDE OPERADORA DE PLANOS DE SAUDE S.A,RJ,35132268972.38,16996743.57638123,51572256.663949706
UNIMED TERESINA - COOPERATIVA DE TRABALHO MÉDICO,PI,34997384622.49,15582094.667181656,48647362.05199637
UNIMED DE MACAÉ COOPERATIVA DE ASSISTÊNCIA À SAÚDE,RJ,34340817124.02,11489065.61526263,38830839.74549394
UNIMED SUL CAPIXABA COOPERATIVA DE TRABALHO MÉDICO,ES,34111116662.29,9302186.163700573,34586173.70501137
CAIXA DE ASSISTÊNCIA DOS FUNCIONÁRIOS DO BANCO DO NORDESTE DO BRASIL,CE,33878580213.239998,18382300.712555613,61749668.99466144
ASSOCIAÇÃO ADVENTISTA NORTE BRASILEIRA DE PREVENÇÃO E ASSISTÊNCIA A SAÚDE,PA,33812650117.98,21800548.10959381,59915848.00205259
UNIMED SÃO CARLOS - COOPERATIVA DE TRABALHO MÉDICO,SP,33552362547.89,12723686.97303375,43604359.29771254
UNIMED DE PRESIDENTE PRUDENTE COOPERATIVA DE TRAB. MÉDICO,SP,33174347828.670002,12050253.479357066,39843869.61351166
HUMANA SAÚDE LTDA.,PR,32817014964.88,11813180.332930166,41122670.428315945
FUNDAÇÃO DE SAÚDE ITAIGUAPY,PR,31815588788.739998,19542744.9562285,48717852.30562011
UNIMED SERGIPE - COOPERATIVA DE TRABALHO MÉDICO,SE,31285863738.16,8235289.217730982,36477501.6918247
UNIMED DE CRICIÚMA COOPERATIVA DE TRABALHO MÉDICO DA REGIÃO CARBONÍFERA,SC,30674589280.07,10083691.413566733,33261984.396984413
COOPERATIVA DE TRABALHO MÉDICO DE POUSO ALEGRE,MG,29696260924.45,12922654.884442994,39256963.2523572
ASSOCIAÇÃO DR. BARTHOLOMEU TACCHINI,RS,28951193519.19,16861498.846354105,42401805.29083431
MEDISERVICE OPERADORA DE PLANOS DE SAÚDE S.A.,SP,28484627728.43,18715261.31959921,58629514.257335655
ASSOCIAÇÃO SANTA SAÚDE,SP,28195848694.73,15216324.174166217,43294877.569769174
UNIMED UBERABA COOPERATIVA DE TRABALHO MEDICO LTDA.,MG,28015284810.35,11148143.577536808,35292869.7943082
UNIMED FRANCA - SOCIEDADE COOPERATIVA DE SERVIÇOS MÉDICOS E HOSPITALARES,SP,27522927830.64,8026517.302607174,29723812.50124089
UNIMED JUNDIAI - COOPERATIVA DE TRABALHO MÉDICO,SP,27502492127.42,10896391.492638668,38331927.67148423
FUNDAÇÃO COPEL DE PREVIDÊNCIA E ASSISTÊNCIA SOCIAL,PR,26281664589.98,18213211.774067912,50148648.794906385
UNIMED CARUARU-COOPERATIVA DE TRABALHO MEDICO,PE,25858513882.0,9918877.591868047,32961873.252915826
REAL GRANDEZA - FUNDAÇÃO DE PREVIDÊNCIA E ASSISTÊNCIA SOCIAL,RJ,25505828829.91,17280371.835982386,48286591.89015312
UNIMED PONTA GROSSA COOPERATIVA DE TRABALHO MEDICO,PR,24921223635.45,9128653.34631868,30596234.62434589
UNIMED NORTE DO MATO GROSSO COOPERATIVA DE TRABALHO MÉDICO,MT,24829935743.13,12123992.062075196,40236605.7839865
HOSPITAL DE CLÍNICAS DE PASSO FUNDO,RS,24352677128.99,32732092.915309142,61471968.62227506
FUNDACAO LEONOR DE BARROS CAMARGO,SP,24208013291.53,20173344.40960833,48145942.48656114
UNIMED SANTA MARIA/RS - COOPERATIVA DE ASSISTÊNCIA À SAÚDE LTDA,RS,24185731151.53,9241777.283733282,28763393.18234189
CIRCULO OPERARIO CAXIENSE,RS,23515407101.79,10535576.658508064,31565560.440358397
DOCTOR CLIN OPERADORA DE PLANOS DE SAÚDE LTDA.,RS,23431448214.43,11120763.272154722,37597988.27013099
COOPERATIVA CENTRAL UNIMED DE COOPERATIVAS DE ASSISTÊNCIA À SAÚDE DO RIO GRANDE DO SUL LTDA.,RS,23410953150.2,6583507.6350393705,25490357.189616896
ASSOCIACAO DOS AUDITORES FISCAIS DA RECEITA ESTADUAL DE SAO PAULO,SP,23068598886.22,14490325.933555277,45405308.982431605
UNIMED DE SANTA BÁRBARA D'OESTE E AMERICANA - COOP DE TRABALHO MÉDICO,SP,23055231733.07,7069988.265277522,26455086.01473764
INSTITUTO CURITIBA DE SAÚDE,PR,22934114575.02,18259645.362277072,53926948.35601362
UNIMED CAMPINA GRANDE - COOPERATIVA DE TRABALHO MEDICO LTDA,PB,22761431730.58,14111240.998499691,36354646.1756946
ASSOCIAÇÃO EVANGELICA BENEFICENTE DE LONDRINA,PR,22751454399.68,10216189.672061069,28863548.8086595
BENEFICENCIA CAMILIANA DO SUL,SP,22621834475.86,19637009.093628474,48959155.889661565
UNIMED REGIONAL DA BAIXA MOGIANA - COOPERATIVA DE TRABALHO MÉDICO,SP,22338707520.31,7629340.000105875,28799684.23197354
SOBAM CENTRO MÉDICO HOSPITALAR S.A.,SP,22201587086.4,11734454.062579282,39279211.82686907
UNIMED VALE DO SÃO FRANCISCO COOPERATIVA DE TRABALHO MÉDICO,PE,21991061400.94,9326149.873172179,31130530.709702596
UNIMED DE ARARAQUARA - COOP. DE TRAB. MÉDICO,SP,21851575148.31,8981329.69515413,29632443.95338415
GAMA SAUDE LTDA.,SP,21023335404.670002,17204038.79269231,56905296.89197059
IRMANDADE DA SANTA CASA DE MISERICÓRDIA DE PASSOS,MG,21008484237.7,13330256.496002538,35555922.22756253
UNIMED FRANCISCO BELTRAO COOPERATIVA DE TRABALHO MEDICO,PR,20971601055.7,11037684.766157895,219022435.50401995
IRMANDADE DA SANTA CASA DE MISERICÓRDIA DE PIRACICABA,SP,20959953161.81,16889567.414834812,37274766.72272322
UNIMED DE DOURADOS COOPERATIVA DE TRABALHO MÉDICO LTDA,MS,20898785772.28,9051011.594750974,27377723.21851465
PLANO HOSPITAL SAMARITANO LTDA,SP,20863650964.079998,13762302.746754616,49776837.22888167
UNIMED DE MARILIA COOPERATIVA DE TRABALHO MÉDICO,SP,20845749148.59,7087979.98931996,26823377.88546668
SANTA CASA DE MISERICÓRDIA DE JUIZ DE FORA,MG,20764910740.87,10356563.960533665,26964456.55562498
SUL AMÉRICA ODONTOLÓGICO S/A,SP,20412073469.47,10548875.178020673,35842487.28228471
UNIMED NOVA FRIBURGO-SOC.COOP.SERV.MED.HOSP.LTDA.,RJ,20263445216.69,9078604.487764336,30145022.438381482
UNIMED REGIONAL JAU - COOPERATIVA DE TRABALHO MÉDICO,SP,20234611337.1,6124277.039073849,21138235.577358823
CAIXA DE ASSISTÊNCIA À SAÚDE - CABERJ,RJ,20230133225.02,12885435.175171975,35887538.80746393
PLANO DE SAÚDE ANA COSTA LTDA.,SP,20206798874.41,10502494.217468815,34064837.07323459
ABERTTA SAÚDE - ASSOCIAÇÃO BENEFICENTE DOS EMPREGADOS DA ARCELORMITTAL NO BRASIL,MG,19882435378.93,10575763.499430852,32630756.741431013
UNIMED DE GUARULHOS COOPERATIVA DE TRABALHO MÉDICO,SP,19880706983.61,7488025.229231639,24612800.59720777
UNIMED PLANALTO MÉDIO/RS - COOPERATIVA DE ASSISTÊNCIA À SAÚDE LTDA.,RS,19548190887.11,9526408.814381093,29776844.792928796
FUNDAÇÃO CHESF DE ASSISTÊNCIA E SEGURIDADE SOCIAL,PE,19487222110.670002,24824486.765184715,53854465.37902231
UNIMED RONDONOPOLIS COOPERATIVA DE TRABALHO MÉDICO LTDA,MT,19484355603.74,5835386.524031147,21555149.732007474
ASSOCIAÇAO DOS FUNCIONARIOS PUBLICOS DO ESTADO DO RIO GRANDE DO SUL,RS,19440795529.32,10818472.748647746,42310546.75284664
UNIMED GOVERNADOR VALADARES COOP. DE TRABALHO MÉDICO LTDA.,MG,19321945034.29,8397194.712859627,27427776.30247254
UNIMED MISSÕES/RS - COOPERATIVA DE ASSISTÊNCIA À SAÚDE LTDA.,RS,19240332572.15,7104997.25707164,25842252.448373295
ASSOCIAÇÃO SANTA CASA SAÚDE DE SÃO JOSÉ DOS CAMPOS,SP,19213229922.94,11170482.513337208,45439435.526451066
UNIMED DE TUBARAO - COOPERATIVA DE TRABALHO MEDICO DA REGIAO DA AMUREL,SC,19159891476.47,5071437.659203283,17801155.80075957
METRUS INSTITUTO DE SEGURIDADE SOCIAL,SP,18806865573.4,12776403.242798913,39432182.47458752
UNIMED DO CEARÁ - FEDERAÇÃO DAS SOCIEDADES COOPERATIVAS MÉDICAS DO ESTADO DO CEARÁ LTDA.,CE,18436441833.13,10838590.14293357,33066130.736215394
UNIMED DE BOTUCATU COOPERATIVA DE TRABALHO MÉDICO,SP,18405482209.3,7991959.274554928,22968950.142525014
UNIMED PORTO VELHO - SOCIEDADE COOPERATIVA MÉDICA LTDA,RO,18229500838.6,8134538.526818384,24795999.9591627
SAMEL PLANO DE SAÚDE LTDA,AM,17944747870.7,12384229.034299517,42457835.30854857
SUPERMED ADMINISTRADORA DE BENEFÍCIOS LTDA.,RJ,17890073759.73,19031993.361414894,41810409.88906282
UNIMED DE ARACATUBA - COOPERATIVA DE TRABALHO MÉDICO,SP,17803671648.91,5395052.014821212,17459648.454205494
UNIMED SALTO/ITU - COOPERATIVA MÉDICA,SP,17623216996.63,6627761.187149305,21969968.43861093
BENEFICENCIA SOCIAL BOM SAMARITANO,MG,17319144249.52,14313342.354975207,36914895.817706406
UNIMED DE CAMPOS COOPERATIVA DE TRABALHO MÉDICO,RJ,17301744737.6,6305300.560349854,21180713.226044115
PLENA SAÚDE S.A.,SP,17286969604.97,8994260.98073361,25590142.663236856
ASSOCIAÇÃO DE SAÚDE PORTUGUESA DE BENEFICÊNCIA,SP,17242612461.48,12083120.155206727,36050186.81931131
PROMÉDICA - PROTEÇÃO MEDICA A EMPRESAS S.A.,BA,17176424256.32,10205837.34778372,34310225.29651754
UNIMED DE LIMEIRA COOPERATIVA DE TRABALHO MÉDICO,SP,17132946258.17,6758558.681723866,22069058.579916902
BIOVIDA SAÚDE LTDA.,SP,16905887265.78,13868652.391944217,34808992.090637535
UNIMED SAÚDE E ODONTO S.A,SP,16615703316.62,9159704.143671446,27609219.45726088
UNIMED LESTE PAULISTA COOPERATIVA DE TRABALHO MÉDICO,SP,16546229969.06,4572044.755197568,17832647.55827264
CAIXA DE PREVIDÊNCIA E ASSISTÊNCIA DOS SERVIDORES DA FUNDAÇÃO NACIONAL DE SAÚDE - CAPESESP,RJ,16434688899.39,14303471.626971278,41149612.814765185
CONFERÊNCIA SÃO JOSÉ DO AVAÍ,RJ,16233360954.45,12997086.432706166,29461959.260972083
FUNDAÇÃO CELESC DE SEGURIDADE SOCIAL - CELOS,SC,16187819138.07,10566461.578374673,30903539.701064408
UNIMED PELOTAS/RS - COOPERATIVA DE ASSISTÊNCIA À SAÚDE LTDA.,RS,16122910597.53,6670629.125995035,20081733.12331497
QUALLITY PRÓ SAÚDE PLANO DE ASSISTÊNCIA MÉDICA LTDA.,DF,16021920348.66,9651759.246180722,35370519.31350004
UNIMED ANHANGUERA COOPERATIVA DE TRABALHO MÉDICO,SP,15847598843.9,6175993.314068589,20501335.58225541
KLINI PLANOS DE SAÚDE LTDA,RJ,15799868714.31,12229000.552871516,35122119.36251054
AUSTACLINICAS ASSISTÊNCIA MÉDICA E HOSPITALAR LTDA,SP,15680581597.98,8625182.397128712,26213561.839423146
UNIMED PATOS DE MINAS COOPERATIVA TRABALHO MÉDICO LTDA.,MG,15568754994.89,4671093.607827783,18806809.510098573
IRMANDADE DA SANTA CASA DE MISERICORDIA DE LIMEIRA,SP,15467471010.0,11700053.714069592,28083516.78952827
LIFE EMPRESARIAL SAÚDE LTDA.,SP,15388522226.96,7879427.663573989,24128271.868040986
UNIMED PALMAS COOPERATIVA DE TRABALHO MÉDICO,TO,15325888962.19,5720749.892568123,17412623.429531787
UNIMED DO SUDOESTE COOPERATIVA DE TRABALHO MEDICO LTDA,BA,15222097873.39,7304269.612951055,21213946.664973173
UNIMED DE BEBEDOURO COOPERATIVA DE TRABALHO MÉDICO,SP,15218390781.24,6421261.933012658,21735117.00187601
UNIMED RIO VERDE COOPERATIVA TRABALHO MEDICO,GO,15178585576.26,6200402.604681373,19674231.0482429
UNIMED NOROESTE/RS - SOCIEDADE COOPERATIVA DE ASSISTÊNCIA À SAÚDE LTDA.,RS,15099353092.57,5843402.899601393,18324635.97977822
METLIFE PLANOS ODONTOLÓGICOS LTDA.,SP,14957488094.25,10676294.142933618,26064948.448813908
MÚTUA DOS MAGISTRADOS DO ESTADO DO RIO DE JANEIRO,RJ,14895786659.03,13895323.375960821,31941307.010686528
SÃO LUCAS SAÚDE S/A,SP,14886720588.95,8358630.313840539,23474749.640769396
BENSAUDE PLANO DE ASSISTENCIA MEDICA HOSPITALAR LTDA.,SP,14846263232.45,8359382.4507038295,29708761.582686514
2CARE OPERADORA DE SAÚDE LTDA.,SP,14817215378.03,9301453.47020088,26743850.925297577
IRMANDADE SANTA CASA DE MISERICÓRDIA DE MARINGÁ,PR,14709588229.89,7955429.004808004,21555457.849146187
UNIMED NORTE/NORDESTE-FEDERAÇÃO INTERFEDERATIVA DAS SOCIEDADES COOPERATIVAS DE TRABALHO MÉDICO EM RECUPERAÇÃO JUDICIAL,PB,14591530423.15,9606010.811816985,29995475.67160742
ALVORECER - ASSOCIAÇÃO DE SOCORROS MÚTUOS,SP,14453050390.87,10286868.605601424,32202042.163815383
BIO SAÚDE SERVIÇOS MÉDICOS LTDA,SP,14385352754.36,11957899.213931838,30809592.17043476
UNIMED POÇOS DE CALDAS - SOC. COOP. DE TRAB. E SERVIÇOS MÉDICOS,MG,14152053080.17,7456297.724009484,18582310.770437587
HOSPITAL DE CARIDADE SÃO VICENTE DE PAULO,PR,14048960792.96,18583281.47216931,50252189.427519746
SANTA CASA DE MISERICÓRDIA DE VOTUPORANGA,SP,13920282235.22,9851579.784302901,25944887.131765537
UNIMED COSTA OESTE - COOPERATIVA DE TRABALHO MÉDICO,PR,13763676304.01,5675742.80577732,18446569.438327264
UNIMED OESTE DO PARÁ - COOPERATIVA DE TRABALHO MÉDICO,PA,13756270462.24,9586251.193198606,25032211.428407926
AMEPLAN ASSISTÊNCIA MÉDICA PLANEJADA LTDA,SP,13659282444.07,10466883.098904215,25320728.36208295
UNIMED AMPARO COOPERATIVA DE TRABALHO MÉDICO,SP,13569479959.78,5614182.854687629,18829600.287803404
S.P.A SAUDE- SISTEMA DE PROMOÇÃO ASSISTENCIAL,SP,13434833570.16,9303901.364376731,25234147.51780743
UNIMED NORDESTE PAULISTA - FED. INTRAFEDERATIVA DAS COOP. MÉDICAS,SP,13419869769.3,5917050.162830687,16667769.736860607
UNIMED DE RIO CLARO SP COOPERATIVA DE TRABALHO MEDICO,SP,13416072194.34,4149728.4857222396,15161310.264585648
AMPLA PLANOS DE SAUDE LTDA,RJ,13300428127.87,17250879.543281455,48032210.01964675
NOSSA SAÚDE - OPERADORA PLANOS PRIVADOS DE ASSISTÊNCIA  À SAÚDE LTDA.,PR,13251357445.67,6319197.637420124,20776588.960439812
UNIMED NOROESTE CAPIXABA COOPERATIVA DE TRABALHO MÉDICO.,ES,13124006823.43,5664223.920340958,17347496.8219736
INTEGRA ASSISTENCIA MEDICA SA,SP,12939642376.86,13736350.718535032,37533836.44679856
ALL CARE ADMINISTRADORA DE BENEFÍCIOS SÃO PAULO LTDA,SP,12904149451.34,9119540.24829682,25537170.23072734
IRMANDADE DA SANTA CASA DE MISERICÓRDIA DE RIO CLARO,SP,12886665205.64,6564781.052287315,17894472.696669925
PROASA SAÚDE,DF,12791747207.52,10096090.929376481,28014520.70801113
UNIMED PETROPOLIS-RJ COOPERATIVA DE TRABALHO MÉDICO,RJ,12778445452.27,5712313.568292356,16242004.463461788
UNIMED VARGINHA COOPERATIVA DE TRABALHO MÉDICO,MG,12698495191.67,5648796.7934475085,15968670.73287618
HOSPITAL MATERNIDADE SÃO VICENTE DE PAULO,CE,12434721036.39,27090895.504117645,38745874.19689579
AMESC - ASSOCIAÇÃO MÉDICA ESPÍRITA CRISTÃ,RJ,12343751557.24,7197522.773900875,20586066.242594253
CAIXA DE ASSISTÊNCIA DOS EMPREGADOS DA EMPRESA BRASILEIRA DE PESQUISA  AGROPECUÁRIA,DF,12191502582.81,10865866.82959893,28093953.95637229
ASSOCIAÇÃO ASSISTENCIAL DE SAÚDE SUPLEMENTAR CRUZ AZUL SAÚDE,SP,12023908649.77,11226805.461970123,29435507.88633866
FUNDAÇÃO AFFEMG DE ASSISTÊNCIA E SAÚDE - FUNDAFFEMG,MG,11927192838.96,9083924.477501903,27264886.616026215
UNIMED VALE DO SEPOTUBA - COOPERATIVA DE TRABALHO MÉDICO,MT,11918175899.9,5028766.2024894515,18240417.90514119
UNIMED VALE DO AÇO COOPERATIVA DE TRABALHO MÉDICO,MG,11883015422.68,7535203.184958783,22063712.048467528
CAIXA DE ASSISTENCIA A SAUDE DA UNIVERSIDADE,MG,11723428228.44,11272527.14273077,25648059.72439326
UNIMED CENTRO OESTE PAULISTA - FEDERAÇÃO INTRAFEDERATIVA DAS COOPERATIVAS MÉDICAS,SP,11656911313.24,7213435.218589108,18987452.545877106
UNIMED MARANHÃO DO SUL - COOPERATIVA DE TRABALHO MÉDICO,MA,11593171611.64,3940574.9869612507,13925738.520019405
UNIMED TEOFILO OTONI COOPERATIVA DE TRABALHO MÉDICO,MG,11556959539.23,6003615.345054545,16968558.598173104
UNIMED CENTRO RONDÔNIA COOPERATIVA DE TRABALHO MÉDICO,RO,11468831216.14,4979952.764281372,17971998.39598826
ALLIANZ SAÚDE S/A,SP,11403243575.29,9526519.27760234,36808029.427046105
SOCIEDADE PORTUGUESA DE BENEFICÊNCIA,RS,11127532309.09,7727452.992423611,19449269.79544807
UNIÃO MÉDICA PLANOS DE SAÚDE S/A,BA,11124681717.74,6974722.080087774,19484206.93526922
UNIMED RIO BRANCO COOPERATIVA DE TRABALHO MEDICO LTDA,AC,11108644873.59,4510209.0432764925,15543246.686621575
UNIMED NORTE CAPIXABA- COOPERATIVA DE TRABALHO MÉDICO,ES,11100139107.55,4274216.059896033,14192565.675868819
FUNDAÇÃO SANEPAR DE ASSISTÊNCIA SOCIAL,PR,11087983370.62,7594509.157958904,22863728.8938231
MED-TOUR ADMINISTRADORA DE BENEFÍCIOS E EMPREENDIMENTOS LTDA.,SP,10848681425.41,6818781.5370270265,20873247.60943041
LIV LINHAS INTELIGENTES DE ATENÇÃO À VIDA S/A,SP,10818421771.66,5513976.438154944,20961862.272918288
UNIMED DO CARIRI - SOCIEDADE COOPERATIVA MÉDICA LTDA,CE,10791401147.27,7546434.36872028,21499216.389136247
UNIMED DE CATANDUVA - COOPERATIVA DE TRABALHO MÉDICO,SP,10771394385.25,3811533.752742392,11771112.83667963
UNIMED ARAXÁ COOPERATIVA DE TRABALHO MÉDICO LTDA.,MG,10713875558.51,4452982.36014547,13555160.036016822
UNIMED ANÁPOLIS COOPERATIVA DE TRABALHO MÉDICO.,GO,10551412086.33,4629842.951439228,13789888.517170021
UNIMED REGIONAL DE CAMPO MOURÃO COOP TRAB MEDICO ,PR,10513318935.76,5334002.504190766,15263961.633887528
CAIXA DE ASSISTÊNCIA À SAÚDE DOS SERVIDORES PÚBLICOS DO ESTADO DO MATO GROSSO DO SUL,MS,10493137494.91,7457809.164825871,22941975.2710873
SERMED-SAÚDE LTDA.,SP,10395987146.52,5250498.558848485,18551823.507460386
SAÚDE BRB - CAIXA DE ASSISTÊNCIA ,DF,10349571968.89,6983516.8481039135,21039735.623911258
UNIMED METROPOLITANA DO AGRESTE - COOPERATIVA DE TRABALHO MÉDICO,AL,10319231365.76,5055968.332072513,14999355.275587725
