RazaoSocial,UF,Total_Despesas,Media_Despesas,Desvio_Padrao
NACIONAL ODONTO OPERADORA DE PLANOS ODONTOLÓGICOS LTDA.,PE,2510453143.15,2113176.046422559,5237528.942825852
UNIMED DE PIRASSUNUNGA COOPERATIVA DE TRABALHO MÉDICO,SP,2505298756.13,1528553.237419158,4363095.391056803
ASSOCIAÇÃO POLICIAL DE ASSISTÊNCIA A SAÚDE DA BAIXADA SANTISTA,SP,2499950169.68,2210389.1862776303,5049170.409207947
UNIMED DE MOCOCA COOPERATIVA DE TRAB. MÉDICO,SP,2420867735.75,1061318.6040113985,3642140.0077567934
UNIMED MACHADO COOPERATIVA DE TRABALHO MEDICO,MG,2345209756.13,1073322.5428512585,3005966.4765588692
ASSOCIAÇAO UNISAUDE MARAU,RS,2327301663.97,2532428.361229597,6976669.407069
ASSOCIAÇÃO VALEPARAIBANA DE ASSISTÊNCIA MÉDICA POLICIAL,SP,2318714148.24,2325691.2219057167,5799834.261025191
POLI SAUDE OPERADORA DE PLANO DE SAUDE LTDA,PR,2280001371.25,1806657.1879952457,4923345.013481915
VIVENTERIS LTDA,PR,2271230092.5,1801134.0939730373,4694167.678029912
UNIMED DE ADAMANTINA-COOPERATIVA DE TRABALHO MÉDICO,SP,2268933700.9,1005287.4173238813,3412003.969775541
OPERADORA DE PLANOS PRIVADOS DE SAÚDE - SANTA CASA SAÚDE LTDA,MS,2266852530.53,1884332.9430839568,5230849.847431962
FEDERAÇÃO DAS COOP ODONTOLÓGICAS DO ESTADO DE SANTA CATARINA,SC,2263225482.86,1234037.8859651037,4214569.4291407745
ASSOCIAÇÃO FUNDO DE PROTEÇÃO À SAÚDE,PR,2223182768.98,2097342.2348867925,5819872.492981628
SANTA CASA DE SAÚDE - SCS,ES,2216436262.24,1730239.0805932863,4905274.850889629
INTERMEDICI PIRACICABA ASSISTENCIA MEDICA LTDA,SP,2207047263.8,1435011.2248374515,4653212.381009921
ASSOCIAÇÃO POLICIAL DE ASSISTÊNCIA À SAÚDE DE RIBEIRÃO PRETO (APAS),SP,2196244118.66,2113805.696496631,5298274.274449849
UNIODONTO DE FORTALEZA COOPERATIVA DE TRABALHO ODONTOLOGICO LTDA,CE,2192620620.94,1406427.5952148815,4111835.5827544495
PB ASSISTENCIA MEDICA EU LTDA,BA,2189344776.16,1946084.2454755553,4773289.451809283
UNIODONTO REGIONAL COOPERATIVA ODONTOLOGICA,MG,2189103487.13,1362229.9235407594,3549805.6792207398
QV BENEFÍCIOS EM SAÚDE LTDA,RJ,2160156323.7,1627849.5280331573,4073673.6588796517
ASSOCIAÇÃO SANTA CASA CLÍNICAS DE BIRIGUI,SP,2121870502.46,1688043.3591567224,5295001.020357793
UNIMED DE MONTE ALTO - COOPERATIVA DE TRABALHO MÉDICO,SP,2105414776.1299999,1368930.2835695709,3549479.6634473735
UNIX SAÚDE S.A,BA,2068019227.54,1549078.0730636704,3962942.0913683637
UNIMED LEOPOLDINA COOPERATIVA DE TRABALHO MÉDICO LTDA,MG,2066941221.96,1198226.7953391306,3492596.284714831
CORPORE ADMINISTRADORA DE BENEFICIOS DA SAUDE LTDA,SP,2056467520.13,1501071.1825766424,4267250.053912164
COOPERATIVA DOS USUÁRIOS DE SERVIÇOS DE SAÚDE DO VALE DO RIO DOS SINOS LTDA,RS,2048250932.94,1961926.1809770116,5296134.55111886
UNIMED FRUTAL COOPERATIVA DE TRABALHO MEDICO LTDA,MG,2046358884.45,839015.5327798278,2877113.98581584
ASSOCIAÇÃO PLANO DE SAÚDE SANTA CASA DE VALINHOS,SP,2042530186.42,1649862.8323263328,4398608.080740266
ASSOCIACAO DOS PROFESSORES UNIVERSITÁRIOS DA BAHIA,BA,2032685167.58,1752314.799637931,4799201.575061917
UNIBEN ADMINISTRADORA DE BENEFÍCIOS LTDA,MG,2032405201.1399999,1862882.8608065993,4813944.524938312
ZURICH SANTANDER BRASIL ODONTO LTDA.,SP,2026998615.79,2904009.478209169,9191935.418094343
G2C ADMINISTRADORA DE BENEFICIOS LTDA - ME,RJ,1987008278.12,3052240.0585560673,6188879.558629839
PLAMER PLANO MEDICO RESENDE LTDA,RJ,1966328138.48,1712829.3889198606,4128818.801121432
UNIODONTO BELÉM - COOPERATIVA DE ASSISTÊNCIA À SAÚDE ODONTOLÓGICA,PA,1961162993.02,1228798.8678070176,3639966.1932937955
UNIMED VALE DO CARANGOLA COOPERATIVA DE TRABALHO MEDICO LTDA,MG,1946798636.68,1252766.1754697554,3201682.3939776826
UNIMED CACERES COOPERATIVA DE TRABALHO MÉDICO ,MT,1940108189.71,728815.9991397446,2305729.4949198156
TRINO - ALIANCA FILANTRÓPICA DE ASSISTÊNCIA E INTEGRAÇÃO PARA O DESENVOLVIMENTO DA SAUDE,ES,1896916988.44,1896916.98844,4945703.50550645
UNIODONTO GOIANIA COOPERATIVA DE CIRURGIÕES DENTISTAS,GO,1885564402.23,1176272.2409419839,3301239.38463441
CAIXA DE ASSISTÊNCIA DO SINDFISCO - CASSIND,SE,1861741657.06,1649018.2967759077,5109687.142952959
UNIMED DE PENAPOLIS - COOPERATIVA DE TRABALHO MEDICO,SP,1855331109.43,823859.2848268206,2201103.4912463184
UNIMED ALTO JACUÍ/RS - COOPERATIVA DE ASSISTÊNCIA À SAÚDE LTDA,RS,1852366804.28,902712.867582846,2290920.5376374386
UNIMED VALE DO CORUMBÁ COOPERATIVA DE TRABALHO MEDICO,GO,1826890412.21,1121479.688281154,3371472.154539461
UNIODONTO PIRACICABA - COOPERATIVA ODONTOLÓGICA,SP,1813284997.34,1180524.0868098957,2964026.891823407
HOSPITAL DE PRONTOCLINICA LTDA.,RS,1795340798.81,1400421.8399453978,3453704.995069741
ASSOCIAÇÃO GOIANA DO MINISTÉRIO PÚBLICO,GO,1794311016.02,1880829.1572536686,4580963.531436529
PLANO ODONTOLÓGICO DENTALVIDAS LTDA.,SP,1793851388.32,1969101.4141822173,6200919.97737501
ASSOCIAÇÃO DOS EMPREGADOS DA COMPANHIA ESTADUAL DE HABITAÇÃO E OBRAS PÚBLICAS - ASSEC,SE,1759176441.73,2059925.575796253,5001410.686090213
ON MED ASSISTÊNCIA MÉDICA LTDA,RS,1759028476.25,1471990.3566945607,3573441.0659640688
UNIODONTO/RN - COOPERATIVA ODONTOLOGICA DO RIO GRANDE DO NORTE,RN,1753014351.3,1196596.8268259384,3429878.464725987
SF SISTEMAS DE SAÚDE LTDA,SP,1743899177.1200001,1824162.31916318,4879001.95725416
MAIS SAÚDE PLANO DE SAÚDE LTDA,GO,1708851507.13,1982426.3423781905,6509982.878001096
PORTOMED - PORTO SEGURO SERVIÇOS DE SAUDE LTDA,SP,1699178768.5,1821199.108788853,5446762.8120546285
EXTRAMED ADMINISTRAÇÃO E SERVIÇOS MÉDICOS LTDA,PR,1694643765.88,1535003.4111231884,3257379.6000108584
UNIMED SOUSA - COOPERATIVA DE TRABALHO MÉDICO,PB,1694255289.0,1291353.1166158537,3063758.335924296
UP HEALTH ADMINISTRADORA DE BENEFÍCIOS S/A,ES,1691585904.27,1467117.0028360798,3717231.8183492674
VIDA TOP MAIS SAÚDE OPERADORA DE PLANOS DE SAÚDE LTDA.,SP,1690178014.6,1115629.052541254,3331919.988664462
SOCIEDADE BENEFICENTE DEZOITO DE JULHO,MG,1686840209.87,1658643.274208456,4297704.99661272
AMEP FREGUESIA OPERADORA DE PLANO DE SAUDE LTDA,RJ,1685063672.78,1307264.2923041116,4470446.631507854
UNIMED REGIONAL DE PICOS - COOPERATIVA DE TRABALHO MÉDICO,PI,1682119978.81,1558961.9822150138,3876434.024633034
MEDIATORIE ADMINISTRADORA DE BENEFÍCIOS S/A,ES,1675542527.86,1375650.6796880132,3766770.82729033
SEMPRE ODONTO PLANOS ODONTOLOGICOS LTDA,RJ,1670954788.54,1328262.9479650238,3836121.311255791
UNIMED CALDAS NOVAS - COOPERATIVA DE TRABALHO MEDICO,GO,1666760215.92,1008934.7553995157,2872251.1758910813
UNIMED MORRINHOS COOPERATIVA DE TRABALHO MEDICO,GO,1619709792.14,1037610.3729276105,2570596.9325628835
UNIMED REGIONAL DE FLORIANO - COOPERATIVA DE TRABALHO MÉDICO,PI,1594483455.96,1266468.1937728357,3240216.4621664565
UNIMED DE CORUMBA COOPERATIVA DE TRABALHO MÉDICO,MS,1563252852.7,988774.7328905757,2459536.7543003648
ASSOCIAÇÃO DOS AUDITORES FISCAIS DA RECEITA ESTADUAL DO RIO DE JANEIRO,RJ,1553111162.61,1611111.1645331949,3806104.185401199
SUL DO PARÁ LTDA,PA,1526068530.47,1284569.4700925925,3217794.1244607884
SV SAUDE ADMINSTRADORES DE PLANO DE SAUDE LTDA,RJ,1521143155.24,1112760.1720848572,3422812.0150975506
FUNDAÇÃO DE ASSISTÊNCIA À SAÚDE DA ASSOCIAÇÃO DO MINISTÉRIO PÚBLICO DO RIO GRANDE DO SUL,RS,1513913808.46,3180491.1942436974,6067693.451486219
AURORA SAÚDE LTDA,MG,1500182242.65,1135641.364610144,3055327.8067047563
FILOSANITAS SAUDE LTDA,SP,1490296995.31,1264034.771255301,3541799.280323127
RESOLVE ADMINISTRADORA DE BENEFÍCIOS LTDA,PI,1487116487.74,2429928.901535948,5224336.935348205
COOPERATIVA DOS USUÁRIOS DE SERVIÇOS DE SAÚDE LTDA.,RS,1463334796.78,1324284.883963801,3553479.889251642
CENTRAL OPERADORA DE PLANOS DE SAÚDE NORTE-NORDESTE LTDA,PB,1455657823.8,2041595.8258064515,5102095.5444656545
PLANO ASSISTENCIAL SÃO LUCAS LTDA,MG,1432786691.0,986767.6935261708,2480344.742495839
UNICONSULT - ADMINISTRADORA DE BENEFICIOS E SERVICOS LTDA,SP,1423153775.08,1118831.5841823898,2659417.177879534
EVANGELICO SAUDE LTDA.,PR,1413631589.02,900402.286,2685975.891599598
ASSOCIAÇÃO POLICIAL DE ASSISTÊNCIA À SAÚDE DE ARAÇATUBA (APAS),SP,1411305272.6,1341544.935931559,3557620.661683425
MAIS SAUDE S/A,ES,1409953254.06,1824001.62232859,4454302.3870467665
FUNDAÇÃO PLAMHUV - PLANO MÉDICO HOSPITALAR DOS HOSPITAIS UNIDOS DE VIÇOSA,MG,1400073260.51,1095518.9831846636,3298819.025905842
RIO DOCE SAÚDE,ES,1399868999.95,1153104.6128088962,2911164.5041121966
UNIODONTO MACEIÓ COOPERATIVA ODONTOLÓGICA,AL,1389885863.22,1104837.729109698,2890175.9856956084
ASSOCIAÇÃO POLICIAL DE ASSISTÊNCIA A SAÚDE,SP,1388335388.11,1470694.2670656778,4054916.5378859784
TECBEN ADMINISTRADORA DE BENEFICIOS LTDA.,SP,1379695478.53,1634710.2826184833,3780830.106274793
UNIMED CAMPO BELO- COOPERATIVA DE TRABALHO MÉDICO,MG,1371143398.28,678112.462057369,1871076.9075689442
PESSOAL SAÚDE PLANOS DE ASSISTÊNCIA MÉDICA LTDA,SP,1353298622.05,1207224.462132025,3519792.3164956816
ASSOCIAÇÃO DO FISCO DE ALAGOAS,AL,1332620328.29,1091417.1402866503,2705200.3871338298
UNIVIDA USA OPERADORA EM SAUDE S/A,SP,1327248733.7,2494828.4468045114,4811030.907706332
UNIODONTO DO BRASIL CENTRAL NACIONAL DAS COOPERATIVAS ODONTÓLOGICAS,SP,1326228696.65,956874.9615079366,2381515.2734338725
FUNDACAO CAPITAL PREVIDENCIA E SAUDE - CAPITAL PREV,ES,1296441508.07,1841536.2330539771,4577453.036357417
VIDAMAX ADMINISTRADORA DE BENEFÍCIOS LTDA,SP,1292819450.49,1119324.1995584415,2721946.0249672327
UNIDENTIS ASSISTENCIA ODONTOLOGICA LTDA.,PB,1288965692.72,1449905.1661642294,3467232.762855575
AME VVIDA PLANOS DE SAUDE INTEGRADO LTDA.,RO,1278898693.04,1436964.8236404494,3505274.098486155
SAMIG - SERV. DE ASSISTENCIA MEDICA DA ILHA DO GOVERNADOR LTDA,RJ,1265019520.32,1039457.2886770747,2099182.277807856
UNIMED SÃO JOÃO NEPOMUCENO COOPERATIVA DE TRABALHO MÉDICO LTDA.,MG,1228894312.68,869090.7444695899,2266287.8265765347
ODONTOART PLANOS ODONTOLÓGICOS LTDA,CE,1203289003.6,879597.2248538011,2388435.012107404
UNIODONTO DE JOÃO PESSOA COOPERATIVA ODONTOLÓGICA,PB,1197766713.13,851896.6665220484,2239538.1026418516
UNIODONTO PAULISTA-FEDERAÇÃO DAS COOPERATIVAS ODONTOLÓGICAS DO ESTADO DE SÃO PAULO,SP,1196129583.31,798484.3680307076,2208473.0737559474
FUNASA SAÚDE,PB,1191267448.27,1110221.2938210624,2712364.1346266507
UNIMED PONTE NOVA COOPERATIVA DE TRABALHO MEDICO LTDA,MG,1188174027.21,694432.5115195792,1816289.6165154094
AME-ASSISTÊNCIA MÉDICA A EMPRESAS LTDA,MG,1160546242.39,946611.9432218598,2040643.787873514
UNIODONTO DO SUL GOIANO COOPERATIVA ODONTOLOGICA,GO,1131749472.32,1084051.2186973179,2433909.307993104
PRIMA VIDA ODONTOLOGIA DE GRUPO LIMITADA,RJ,1115617813.09,1053463.468451369,2481008.902046543
ASSOCIAÇÃO DOS FUNCIONÁRIOS FISCAIS DO ESTADO DO AMAZONAS - AFFEAM,AM,1103426706.0,864077.2952231793,2267863.0308574755
ASSOCIAÇÃO SAÚDE RURAL ALEGRETE,RS,1088279843.43,1248027.3433830277,3585533.7307990314
MEDGOLD ASSISTENCIA MEDICA LTDA - ME,MG,1075187636.76,770191.7168767909,1839476.9741785387
ODONTOGROUP SISTEMA DE SAÚDE LTDA.,DF,1069506688.23,772206.9951119134,2300359.662924343
XP ADMINISTRADORA DE BENEFÍCIOS LTDA.,SP,1054309397.84,2015887.9499808797,4276509.844315288
LANCERS ADMINISTRADORA DE BENEFÍCIOS DE SAÚDE LTDA.,SP,1042650568.37,812666.070436477,2103373.5019203997
CAMIM OPERADORA DE PLANO DE SAÚDE LTDA,RJ,1010565891.71,1150986.2092369022,2588539.6983580887
DENTALPAR ASSISTÊNCIA ODONTOLÓGICA EMPRESARIAL LTDA.,SP,1003937141.34,803792.7472698159,1908945.278742937
ATITUDE SAÚDE ASSISTÊNCIA MEDICA LTDA,BA,967727524.62,1323840.6629548564,2672072.616791415
CAIXA ASSISTENCIAL UNIVERSITARIA DO RIO DE JANEIRO,RJ,955769447.86,894078.0616089804,2330419.5334687275
ASSOCIACAO POLICIAL DE ASSISTENCIA A SAUDE DE PRESIDENTE PRUDENTE (APAS),SP,953923674.36,811849.935625532,2288080.109304182
CONFIANÇA ASSISTÊNCIA MÉDICO HOSPITALAR LTDA,MG,924112417.3,820703.7453818828,1820271.608948284
SERVDONTO - PLANO DE ASSISTÊNCIA ODONTOLÓGICA LTDA,SE,917214331.98,755530.7512191104,2064554.3461392885
CEAM BRASIL - PLANOS DE SAÚDE LTDA,MG,900829722.16,1794481.5182470118,4485274.6619265005
ASSOCIAÇÃO DOS FISCAIS DE TRIBUTOS ESTADUAIS DO RS - AFISVEC,RS,880572266.7,1052057.6663082438,2213603.174272632
UNIODONTO DE JUNDIAÍ COOPERATIVA ODONTOLÓGICA,SP,879890210.06,603491.2277503429,1450301.7218295422
FUNDO DE ASSISTÊNCIA MÉDICO-HOSPITALAR DO MINISTÉRIO PÚBLICO,MS,876369180.41,1053328.3418389424,2172874.813508248
UNIMED VALE DO PARAÍBA - FEDERAÇÃO INTRAFEDERATIVA DAS COOPERATIVAS MÉDICAS,SP,872540253.4,592355.9086218601,1680855.488039639
ORALE ASSISTÊNCIA ODONTOLÓGICA LTDA,BA,871394931.73,767073.0032834507,1948174.3122621796
SEPACO SAÚDE LTDA,SP,859433929.49,1320175.0068970814,2945033.285149171
MUITO MAIS SAÚDE ADMINISTRADORA DE BENEFÍCIOS,RJ,855347313.91,1581048.6393900185,4838358.483139712
UNIODONTO DE MANAUS - COOPERATIVA ODONTOLÓGICA LTDA.,AM,841673099.57,583280.0412820514,1576878.6130766969
ASSOCIACAO POLICIAL DE ASSISTENCIA A SAUDE DE ITAPETININGA,SP,836496822.04,831507.7753876739,2203484.589272457
OPLAN SAÚDE OPERADORA DE PLANO DE SAÚDE LTDA,RJ,823718131.18,590902.5331276901,1708498.5915761588
ASSOCIACAO DE SAUDE HOLAMBRA,SP,817084107.52,1003788.8298771499,2321078.504671088
PLATINUM ADMINISTRADORA DE BENEFICIOS,DF,808598589.47,698875.1853673293,1845197.099389292
SISTEMA TOTAL DE SAÚDE LTDA.,SP,805372102.08,661225.0427586207,1673022.2764933535
MEDHEALTH PLANOS DE SAÚDE LTDA,PR,799326017.35,782119.3907534247,1956199.3117328645
SD-M OPERADORA DE PLANOS DE SAUDE LTDA,RJ,798668718.22,1174512.8209117646,2409502.0761771956
AESP ODONTO ASSISTÊNCIA ODONTOLÓGICA S/S LTDA EPP,SP,786793361.65,987193.6783563362,2419987.0432552965
S1 OPERADORA DE PLANO DE SAÚDE LTDA,DF,778815933.43,836536.9854242749,1821613.544721759
CAIXA BENEFICENTE DOS FUNCIONÁRIOS DO GRUPO IGUAÇU,PR,776018493.9,773697.4016949153,2165373.0675580287
R.M.I. OPERADORA DE SAÚDE INTEGRADA LTDA,SP,771038774.88,1433157.574126394,3264416.8490830804
UNIMED CAJAZEIRAS - SOCIEDADE COOPERATIVA DE TRABALHO MÉDICO,PB,768806095.03,697646.1842377495,1658940.1221428653
PRONTO SOCORRO CONDE DE MOREIRA LIMA,SP,766237685.22,524820.3323424658,1330811.6295597078
UNIODONTO UBERABA - COOPERATIVA DE ASSISTÊNCIA À SAÚDE ODONTOLÓGICA LTDA,MG,739988497.03,535835.2621506155,1377973.4427553548
"VOCÊ CLUBE DE BENEFÍCIOS SOCIAIS, SAÚDE E ODONTOLÓGICO LTDA",SP,734523857.6,765926.8588112617,1701402.3630318807
ANGELI SISTEMAS DE SAUDE S.A.,PR,732291090.53,711653.1492031098,1640855.1333810538
TELOS - FUNDAÇÃO EMBRATEL DE SEGURIDADE SOCIAL,RJ,725021169.61,936719.857377261,2075557.384072881
FUNDO DE ASSISTÊNCIA À SAÚDE DOS FUNCIONÁRIOS DO BEC,CE,695160806.28,719628.1638509317,1971294.2497530505
UNIODONTO DE AMERICANA COOPERATIVA ODONTOLÓGICA,SP,686469647.71,548736.7287849721,1446983.7118781128
UNIMED VALE DO URUCUIA - COOPERATIVA DE TRABALHO MEDICO LTDA,MG,682488101.95,493127.2412933526,1426647.209114464
VOCÊ TOTAL PLANOS DE SAÚDE LIMITADA,SP,667230147.12,736457.1160264901,1642031.1440687266
CEDPLAN SAÚDE LTDA EPP,MG,660227195.49,514195.63511682244,1220011.8061223656
TOTAL ASSISTÊNCIA MÉDICA HOSPITALAR LTDA,MG,659968627.1,805822.4995115995,1987230.556013702
"CAIXA DE ASSISTÊNCIA À SAÚDE DOS TRABALHADORES NAS INDÚSTRIAS METALÚRGICAS, MECÂNICAS E DO MATERIAL ELÉTRICO DE BRUSQUE",SC,658096424.29,854670.6808961038,1969903.1717445757
UNIODONTO DE SOROCABA COOPERATIVA ODONTOLÓGICA,SP,654000424.05,460239.5665376495,1191188.7809133749
BLUZZ SAÚDE S/A,ES,652932455.87,615974.0149716982,1946498.5778956476
ASSOCIAÇÃO PADRE PIO PLANOS DE SAÚDE,SP,646078316.47,712324.4944542449,2120421.255822504
SERVIX ADMINISTRADORA DE BENEFÍCIOS LTDA,DF,638698447.83,694992.8703264418,1335009.080848345
CARING SAÚDE ASSISTÊNCIA MÉDICA LTDA.,RJ,636788460.87,809134.0036467599,1464806.3156187527
MEDIC GLOBAL PLANOS DE SAÚDE LTDA.,MG,612327374.62,525152.1223156089,1316545.4210326434
DONA SAÚDE CLINICAS LTDA ,SP,601337268.66,741476.2868803946,1460327.4093544174
ODONT-OPERADORA ODONTOLOGICA LTDA,SP,598878061.71,482188.4554830918,1249337.4979464626
ASSOCIAÇÃO SERVIÇOS ODONTOLÓGICOS DA INDÚSTRIA DE MINAS GERAIS - ODONTOINDUSTRIA,MG,595553146.08,1248539.0903144656,2032775.4682661295
UNIODONTO DE ARARAQUARA COOPERATIVA ODONTOLÓGICA,SP,590231702.57,434633.06522091315,1144574.6160353732
DENTAL GOLD ASSISTÊNCIA ODONTOLÓGICA LTDA.,PB,589119630.31,521344.80558407074,1108515.4724887793
LIVRI OPERADORA DE PLANO DE SAÚDE LTDA,SP,568572565.88,631046.1330521642,1832082.4586412336
ASSOCIAÇÃO UNIVIDA SANTA RITA DO PASSA QUATRO,SP,561212998.86,427428.02654988575,1120554.769969846
DENTAL CENTER LTDA,PB,551332719.3,390185.9301486199,1112734.866867864
NOSAMED ASSISTÊNCIA MÉDICA LTDA.,SP,549903899.01,486210.3439522546,1206940.0544566533
PLAMESC PLANOS DE SAÚDE LTDA,RJ,527836317.72,455031.30837931036,1210371.4391337743
ÔNIX OPERADORA DE PLANOS DE SAÚDE LTDA,RJ,515383999.16,460575.51310098305,1100770.7948231301
PERSONAL CARE OPERADORA DE SAÚDE SA,SP,509642624.03,555166.2571132898,1485714.094263793
COMSEDER - COOPERATIVA DE ASSISTÊNCIA MÉDICA DOS SERVIDORES DA SUPLAN E DO DER LTDA,PB,508008348.77,537574.9722433862,1294852.8153384298
ASSOCIAÇÃO POLICIAL DE ASSISTENCIA À SAUDE DE SAO JOAO DA BOA VISTA,SP,505858463.84,586162.7622711471,1477734.1698114986
UNIODONTO MARINGA COOPERATIVA ODONTOLOGICA,PR,501769143.51,381573.4931634981,971059.3766424839
UNIODONTO VALE HISTORICO COOPERATIVA ODONTOLOGICA,SP,500172491.13,416463.35647793504,1044036.5839786779
ASSOCIAÇÃO POLICIAL DE ASSISTÊNCIA À SAÚDE DE BARRETOS,SP,498035924.34,702448.4123272214,1500456.2783087916
COOPERATIVA ODONTOLÓGICA DO ESTADO DO AMAPÁ,AP,498012196.36,329155.45033707866,900683.5847918453
HSMED SAUDE LTDA,RJ,497200901.31,469057.4540660377,1014836.7172009386
PLANO VIDA SAUDE SERVIÇOS ODONTOLOGICOS LTDA,SE,495584975.94,456760.34648847923,1131327.2329683173
EVOLUÇÃO ADMINISTRADORA DE BENEFICIOS LTDA ,MG,491466827.09,1047903.6824946695,2047099.983547947
SOCIEDADE DE ASSISTÊNCIA MÉDICA - SAMEISA,RS,486133633.24,620068.409744898,1604248.2478369602
UNIODONTO DE LONDRINA COOP. ODONTOLÓGICA,PR,485143543.26,311989.4168874598,820006.2294807328
PREVENT SENIOR CORPORATE OPERADORA DE SAÚDE LTDA.,SP,480234565.21,767147.8677476038,2655421.761720052
ODILE SERVIÇOS DE SAÚDE LTDA.,SP,473755221.54,746071.215023622,1857830.1586409488
COOPERATIVA ODONTOLÓGICA POÇOS DE CALDAS,MG,473234434.14,342179.6342299349,905010.5008899337
PLANO DE ASSISTÊNCIA MÉDICA MINEIRA LTDA,MG,468234176.28000003,471534.9207250756,1014332.2948091099
HOSPITAL S.P. LTDA.,RS,459237352.1,437368.9067619048,1272543.1190074931
ASSOCIAÇÃO HOSPITAL SAÚDE DE VARGEM GRANDE DO SUL,SP,456989011.6,595037.7755208333,1123911.1019196408
REAL GRANDEZA SAÚDE,RJ,449956704.64,1363505.1655757576,2778443.6472478597
UNIODONTO DE PRESIDENTE PRUDENTE COOPERATIVA ODONTOLOGICA,SP,447100976.4,336166.1476691729,906302.6806247814
ASSOCIAÇÃO POLICIAL DE ASSISTÊNCIA À SAÚDE DE JAÚ,SP,436345922.36,447993.7601232033,1059865.2100120075
UNIODONTO RS FEDERACAO DAS UNIODONTOS DO RGS LTDA,RS,434529093.25,352416.13402270887,846013.0262571822
UNIODONTO ESPIRITO SANTO COOPERATIVA ODONTOLOGICA,ES,427039534.95,333104.16142745706,869389.8075257883
DENTAL PLUS CONVÊNIO ODONTOLÓGICO LTDA.,SP,424101599.32,395986.5539869281,925803.0583736892
BCI ADMINISTRADORA DE BENEFÍCIOS LTDA.,SP,415772679.21,564908.531535326,1314027.294117888
SAUDIA ASSISTENCIA MÉDICA LTDA,MG,413158991.2,381847.4964879852,1057377.7166526993
PORTO DIAS SAUDE LTDA.,PA,411347868.3,627054.6772865853,1506526.4139372052
ASSOCIACAO CIVIL PRÓ-SAÚDE DOS SERVIDORES DA UNIVERSIDADE ESTADUAL DE PONTA GROSSA,PR,411071348.62,522991.5376844784,1236072.2616998418
UNIODONTO DE MATO GROSSO COOP TRAB ODONTOLOGICO LTDA,MT,403401091.53,309119.61036781606,717005.1559315415
ASSOCIAÇÃO POLICIAL DE ASSISTÊNCIA À SAÚDE DE PRESIDENTE VENCESLAU,SP,402113853.61,392306.19864390243,927841.2248768399
UNIODONTO JACAREÍ COOPERATIVA ODONTOLÓGICA,SP,400148746.0,307570.1352805534,742835.571330988
DENTAL MASTER LTDA - EPP,AL,390925252.03,366034.8801779026,971973.7594046815
SALUPLAN ADMINISTRADORA DE BENEFÍCIOS LTDA,SP,390315836.63,614670.6088661418,1302042.4873147435
QUALITY GOLD SAÚDE ADMINISTRADORA DE PLANOS DE SAÚDE LTDA-ME,RJ,384695798.08,436163.0363718821,1020086.8512519187
ODONTOLIVE OPERADORA DE PLANOS ODONTOLÓGICOS LTDA.,SP,382328907.09,397018.5951090342,960913.5740952976
RODRIGUES LEIRA ODONTOLOGIA LTDA.,SP,381828185.55,325791.9671928328,977169.1489131504
QUALI ADMINISTRADORA DE BENEFÍCIOS S/A,ES,377153029.11,1053500.0813128492,2269389.693796889
PD BRASIL ASSISTENCIA ODONTOLOGICA LTDA,MG,375494565.76,341048.6519164396,950928.0428705222
CASA DE SAÚDE NOSSA SENHORA DE FÁTIMA  LTDA.,CE,375065225.22,573494.2281651377,1171416.70128637
PLENUM ASSISTENCIA MEDICA  LTDA,DF,374439367.77,793303.7452754237,1679383.069053569
EXCELÊNCIA PLANO DE SAÚDE S/A,ES,351292681.83,342390.5280994152,914830.6274057549
A.P.S. ADMINISTRADORA DE BENEFÍCOS LTDA.,SP,350688363.88,442229.96706179064,1104887.3312888741
UNIMED PARAIBA - FEDERAÇAO DAS SOCIEDADES COOPERATIVAS DE TRABALHO MEDICO,PB,350024782.58,444758.30060991104,942487.7122645035
ASSOCIAÇÃO POLICIAL DE ASSISTÊNCIA À SAÚDE DE DRACENA,SP,345591742.76,413387.2521052631,876686.6478495061
INTERCLINICAS PLANO VIDA USA OPERADORA DE SAUDE LTDA,SP,343594697.7,740505.8140086207,1215498.877066039
HEALTH-MED SISTEMA DE SAUDE LTDA,RJ,336549167.87,471357.3779691877,1047714.0188907823
BIORAL SISTEMA ODONTOLÓGICO LTDA.,SP,332800347.55,359784.1595135135,1087817.409128678
ASSOCIAÇÃO POLICIAL DE ASSISTÊNCIA À SAÚDE APAS,SP,331536013.71,323765.63838867185,763915.1840148238
INNOVA PLANO DE SAUDE LTDA,RO,331201906.87,441602.54249333334,883228.8493161093
MH VIDA - OPERADORA DE PLANOS DE SAÚDE LTDA,RJ,330535937.1,349403.73900634254,767325.5122672409
SORRIDEN CONVÊNIOS ODONTOLÓGICOS S.A.,SP,329720427.94,303330.66047838086,681913.4730947838
BENEFIT ADMINISTRADORA DE BENEFÍCIOS LTDA.,SP,327638119.96,470069.03868005733,998537.3442196689
ARL ADMINISTRADORA DE BENEFÍCIOS LTDA.,SP,325778118.62,384172.3096933962,830918.6265965769
ASSOCIACAO DOS SERVIDORES DA EMDAGRO - ASSEM,SE,324645968.09,616026.504914611,1045438.4245705919
VITTA SAUDE ADMINISTRADORA DE BENEFICIOS LTDA.,SP,323973534.23,636490.2440667977,1930242.2417963536
PLANO DE ASSISTÊNCIA ODONTOLÓGICA FAUCHARD LTDA. ME,BA,323506148.27,319354.53925962484,774366.9907691244
ASSOCIAÇÃO DOS SERVIDORES PÚBLICOS DA ADMINISTRAÇÃO DIRETA DO GOVERNO DO ESTADO DO PARÁ - ASPARÁ,PA,321768840.06,356728.20405764965,903103.8327435568
SALUSMED OPERADORA DE PLANOS DE SAUDE LTDA,SP,316306834.12,331558.5263312369,703952.8845566792
CROWN ODONTOLOGIA DE GRUPO LTDA,SP,315646001.74,240767.35449275363,579339.392608079
CAIXA DE ASSISTÊNCIA DOS EMPREGADOS DO SETOR PÚBLICO DO ESTADO DE GOIÁS - CAEME,GO,313297397.46999997,392603.2549749373,852465.1332808634
VALE PLANOS DE SAÚDE LTDA,PE,312212505.05,355595.1082574032,954309.4114831426
COOPERATIVA DE TRABALHO ODONTOLOGICO - UNIODONTO ITAJUBÁ,MG,307331645.31,250882.9757632653,613546.7947938782
ASSOCIAÇÃO POLICIAL DE ASSISTENCIA A SAUDE DE BOTUCATU,SP,297813492.03,332381.12949776783,714936.8568008889
PLURICLUB ADMINISTRADORA DE BENEFÍCIOS LTDA.,SP,288558219.35,458757.1054848967,859520.0933454108
YOU ASSISTÊNCIA MÉDICA LTDA.,MG,285099996.46,1267111.0953777777,2705874.0977450954
MAXMED ADMINISTRADORA DE BENEFICIOS LTDA,SP,273518379.6,259013.61704545456,640549.4943226334
INFINITY SAÚDE SUPLEMENTAR LTDA,MT,264466813.97,325297.43415744154,758450.3602677528
SISTEMA PREVSAUDE DENTAL LTDA,CE,262279518.55,302165.34395161294,611224.7353678751
ASSOCIAÇÃO POLICIAL DE ASSISTÊNCIA À SAÚDE - VALE DO RIBEIRA,SP,258477740.39,284353.9498239824,668654.0511812931
"ASSOC DE ASSIST À SAÚDE DOS SERV DAS UNIV E INST FED, EST E/OU FAC PART EM PE",PE,258143824.64,360033.2282287308,761640.6441145901
QUALIDONTO - QUALIDADE EM ODONTOLOGIA LTDA ,BA,255775500.83,297759.6051571595,727440.7309828657
UNIODONTO DE PINDAMONHANGABA COOP ODONTOLOGICA,SP,237030725.22,184316.27155520994,475739.9006776936
PRESERVE SAUDE ASSISTENCIA MEDICA LTDA,BA,234096312.67,217764.0117860465,611712.2714752406
ODONTO PRIME S/S LTDA,CE,233511610.07,468898.81540160644,765563.886024317
CENTRO DE ENDOCRINOLOGIA DE JUNDIAÍ S/S LTDA,SP,231899866.18,217338.2063542643,468763.5473271591
UNIODONTO DE SERTAOZINHO SP COOPERATIVA ODONTOLOGICA,SP,227488010.63,304128.3564572192,746738.5123162976
ALMA ODONTO OPERADORA DE PLANOS ODONTOLOGICOS LTDA,SP,222647694.52,351734.1145655608,578411.5500744957
NOVODENTE S/A,RS,213403246.4,583068.9792349727,1731623.229400646
EVO SAUDE ASSISTENCIA MEDICA LTDA,DF,207554744.0,243038.34192037472,742422.8120707899
SAME-SERVIÇO DE ASSISTÊNCIA MÉDICA EMPRESARIAL LTDA.,MA,201872408.55,256183.2595812183,479960.55739019817
UNICOR ADMINISTRADORA DE BENEFICIOS LTDA,MG,196609708.96,208272.996779661,468178.93699159625
CASE - CENTRAL DE ADMINISTRAÇÃO DE PLANO DE SAÚDE LTDA,RJ,194424570.32,288892.3778900446,592604.9641052426
UNIMED ALTO PARANAIBA COOPERATIVA DE TRABALHO MEDICO,MG,182570244.66,141857.22195804195,375961.91431292926
AMPLITUDE PLANOS DE SAUDE LTDA ,MG,164869763.12,477883.37136231887,952403.4281367983
ASSISTÊNCIA MÉDICA 12 DE OUTUBRO LTDA,SP,160760025.12,426419.1647745358,715142.0593934496
POLIMÉDICA SAÚDE SOCIEDADE SIMPLES LTDA,RS,150962886.58,157910.96922594143,434742.2893263477
PLAMEDH - PLANO DE ASSISTÊNCIA MÉDICO-HOSPITALAR LTDA,MG,138391700.62,302826.478380744,514207.7693139326
G & M ASSESSORIA MEDICA EMPRESARIAL LTDA,RJ,133044115.51,120729.68739564429,279681.3091899052
AIRES OPERADORA DE SAUDE LTDA,PE,126967437.51,197461.02256609642,503966.49282540515
BRASIL ODONTO OPERADORA DE PLANOS ODONTOLÓGICOS LTDA,TO,126907678.76,140540.06507198227,313685.1799285926
CLÍNICA SÃO GABRIEL S/S LTDA,SP,120151881.1,151324.78727959696,408359.426365192
SAGRADA SAÚDE ASSISTÊNCIA MÉDICA LTDA,MG,119956732.95,196973.28891625616,498436.6567788022
PLANO SIGMA SAÚDE LTDA,SP,118396431.5,238702.4828629032,436850.9000004326
